RCAB,Code,Name,Start Date,End Date,Status
TVET,1,Office of the Student Identifiers Registrar,5-Nov-14,,Current
NSW VETAB,20,Tourism Training Australia,1-Jan-98,28-May-02,Non-Current
ASQA,22,Adelaide Training and Employment Centre Inc,28-Oct-13,27-Oct-18,Current
ASQA,29,Australian Taxation Office,1-Jan-93,30-Jun-15,Cancelled
Tas TQA,32,Adult Migrant English Service,1-Jan-93,1-Jun-98,Non-Current
Vic VRQA,33,Pilkington (Australia) Ltd,1-May-94,24-Mar-09,Non-Current
Vic VRQA,34,Creative Informatics Pty Ltd,1-May-98,31-May-03,Non-Current
ASQA,36,Transport Training Centre Inc (in Liquidation),31-Dec-14,30-Dec-19,Current
WA TAC,38,Adam Voak,12-Dec-96,30-Sep-14,Non-Current
QLD DETE,39,Jubilee International Christian College Ltd,1-Jan-98,31-Dec-01,Non-Current
NSW VETAB,43,Whitehouse Investments Australia Pty Ltd,23-Sep-96,30-Aug-07,Non-Current
NSW VETAB,46,Metropolitan College of Australia,12-Aug-94,6-May-02,Non-Current
WA TAC,47,Balga Job Link,25-Mar-94,31-Dec-99,Non-Current
ASQA,49,Australian Institute of Management Education and Training,29-Jun-12,31-Dec-16,Current
ASQA,50,Australian Army,1-Dec-13,30-Nov-18,Current
WA TAC,55,Beaufort College,26-Mar-93,31-Dec-98,Non-Current
WA TAC,56,Australia PCC Pty Ltd,1-Aug-02,30-Sep-07,Cancelled
WA TAC,57,Catona Pty Ltd,9-Nov-95,31-Jul-09,Non-Current
ASQA,58,Australian Institute of Management HRD Inc,31-Aug-12,30-Aug-17,Current
WA TAC,61,WESTN Employment Services (Whitfords),22-Apr-94,31-Dec-99,Non-Current
ASQA,64,The University of Notre Dame Australia,1-Jun-14,31-May-19,Current
ASQA,67,Harvest Bible College Ltd,1-Mar-13,28-Feb-18,Current
ASQA,71,VOCATIONAL EDUCATION AND TRAINING (MIIT),1-Oct-12,30-Sep-17,Current
QLD DETE,73,Queensland Breweries Pty Ltd,1-Jan-98,3-Jun-01,Non-Current
QLD DETE,77,Kelly Business College Pty Ltd,1-Jan-98,30-May-06,Non-Current
QLD DETE,78,Campion College Pty Ltd,1-Jan-98,24-Jun-08,Non-Current
ASQA,80,Heather Langton Pty Ltd,1-Jul-13,30-Jun-18,Current
ASQA,83,TAFE Queensland,1-Mar-13,28-Feb-18,Current
QLD DETE,85,VOCATIONAL EDUCATION AND TRAINING,1-Jan-98,30-Sep-07,Non-Current
QLD DETE,94,Bridging the Gap Job Help Gold Coast Inc,1-Jan-98,30-Jul-07,Non-Current
ASQA,95,Cairns Business College Pty Ltd,29-Jun-12,16-Jan-17,Current
WA TAC,97,WA Fire & Rescue Service,25-Feb-94,31-Dec-99,Non-Current
ASQA,101,Canberra Institute of Technology,1-Jul-11,1-Apr-17,Current
SA DFEEST,103,Australia Post (SA/NT),1-Jan-93,31-Jan-00,Non-Current
ASQA,104,CAREER EMPLOYMENT AUSTRALIA INCORPORATED,22-Aug-12,21-Aug-17,Current
ASQA,107,NSW TAFE Commission,7-May-97,6-May-02,Non-Current
Vic VRQA,108,KODAK (Australasia) Pty Ltd,1-Nov-97,30-Nov-04,Non-Current
ASQA,109,Australian College of the Arts Pty Ltd,1-Aug-15,31-Jul-22,Current
ASQA,111,Photography Holdings Pty Ltd,1-May-15,30-Apr-20,Current
QLD DETE,112,Innisfail Skillshare Centre,1-Jan-98,10-Oct-00,Non-Current
Vic VRQA,113,Brotherhood of St Laurence,1-Jan-93,31-Jan-20,Current
WA TAC,114,Laurielee Pty Ltd,25-Jan-12,31-Jan-17,Current
ASQA,115,Impact Community Services Inc,1-Oct-15,30-Sep-22,Current
ASQA,117,Ford Motor Company of Australia Ltd,1-Dec-14,30-Nov-19,Current
ASQA,118,Community Agency for Development Employment and Training Inc,29-Jun-12,31-Jul-16,Current
WA TAC,122,Industry and Vocational Enterprise Centre (IVEC),21-May-93,31-Dec-98,Non-Current
ASQA,127,North East Region Training Association Incorporated,7-Apr-14,30-Sep-18,Current
WA TAC,130,Langford Skillshare,21-May-93,31-Dec-98,Non-Current
WA TAC,131,"Wearne Training Centre, The (Employment 2000 Skillshare)",14-Mar-97,31-Dec-98,Non-Current
WA TAC,132,Maylands Skilltrain,30-Sep-94,31-Dec-00,Non-Current
WA TAC,133,Northsyde Employment and Training Scheme Inc,20-Dec-96,30-May-97,Cancelled
WA TAC,134,Rockingham Skillshare,21-May-93,31-Dec-98,Non-Current
WA TAC,136,Arnica Holdings Pty Ltd,10-Aug-93,30-Oct-07,Non-Current
ASQA,137,ASHT Pty Ltd,1-Mar-13,28-Feb-18,Current
SA DFEEST,138,Department of Social Security (SA),1-Jan-94,30-Jun-99,Non-Current
SA DFEEST,140,The Perfect Fit Pty Ltd,31-Jul-01,1-Aug-03,Non-Current
SA DFEEST,141,Hyde Park College of Beauty Therapy & Cosmetology Pty Ltd,29-Jul-03,29-Jul-08,Non-Current
ASQA,142,Chabad Institutions of Australia Inc,1-Mar-13,28-Feb-18,Current
Vic VRQA,143,Australian Maritime Safety Authority (QLD),1-Mar-97,31-Mar-00,Non-Current
ASQA,145,BAPTIST UNION OF WA INCORPORATED,22-Jan-13,21-Jan-18,Current
WA TAC,149,Retail Skills Centre WA Inc,15-Feb-01,30-Jun-04,Non-Current
ASQA,150,Royal Australian Navy,1-Jun-14,31-May-19,Current
Vic VRQA,152,PMP Communications Limited,1-Jun-97,30-Jun-05,Non-Current
WA TAC,153,Modallin Pty Ltd trading as Australian Learning Academy,16-Nov-00,31-Dec-03,Non-Current
ASQA,156,TexSkill Limited,1-Apr-14,31-Mar-19,Current
SA DFEEST,158,"Writing Room, The",12-Jan-93,30-Jun-99,Non-Current
QLD DETE,160,C. & N. Buchanan Pty. Ltd. as trustee for The Buchanan Trust,1-Jan-98,29-Feb-08,Non-Current
QLD DETE,162,Department of Employment and Training,1-Jan-98,31-Dec-02,Non-Current
Vic VRQA,163,Denso Automotive Systems Australia Pty Ltd,1-Sep-93,30-Sep-15,Cancelled
QLD DETE,164,WB & S BARLIN AND PR COOK,1-Jan-98,21-Oct-08,Non-Current
ASQA,165,Casuarina Senior College Council Inc,1-Apr-99,14-Feb-14,Cancelled
NT DET,166,Julalikari Council Aboriginal Corporation,1-Aug-93,30-Jun-03,Non-Current
ASQA,167,Institute for Aboriginal Development (Aboriginal Corporation),1-Apr-12,31-Mar-17,Current
ASQA,168,Nungalinya College Incorporated,1-Dec-14,30-Nov-19,Current
Vic VRQA,170,The Suzan Johnston Organization (Aust) Pty Ltd,31-Oct-07,31-Oct-17,Current
ASQA,173,Holmes Commercial Colleges (Melbourne) Ltd,1-Jan-15,31-Dec-19,Current
WA TAC,179,Kalgoorlie College,22-Dec-93,31-Dec-98,Cancelled
WA TAC,180,Excel Education Pty Ltd,14-Dec-95,21-Jun-08,Non-Current
WA TAC,181,Edith Cowan University,8-Jun-95,30-Sep-09,Non-Current
WA TAC,182,3CM Pty Limited,11-Sep-14,30-Nov-18,Current (Suspended)
WA TAC,183,Perth Hospitality Professionals,16-Dec-94,9-Aug-97,Non-Current
WA TAC,184,Perth Bible College Inc.,18-Feb-94,30-Sep-07,Non-Current
ASQA,186,Clip Joint Academy of Hairdressing Pty Ltd,4-Jul-13,3-Jul-18,Current
ASQA,188,Newabon Pty Ltd,1-Jan-02,23-Sep-11,Non-Current
SA DFEEST,193,Uniting Church in Australia - Parkin-Wesley College,1-Jan-94,30-Jun-99,Non-Current
ASQA,195,PARTEC (Qld) Pty Ltd,1-Oct-15,30-Sep-22,Current
ACT DET,200,Australian Institute of Management (ACT Division),1-Dec-93,31-Dec-01,Non-Current
ASQA,201,Transport Industries Skills Centre Inc,26-Oct-12,25-Oct-17,Current
SA DFEEST,228,Stones & Muirden Business College Ltd,19-Dec-03,21-Jun-08,Non-Current
SA DFEEST,230,Retail Industry Training and Advisory Services SA Inc,26-Nov-02,26-Nov-07,Non-Current
SA DFEEST,231,The John Pearce Group (SA) Pty Ltd,11-Aug-99,31-Dec-01,Non-Current
ASQA,233,LM Training Specialists Pty Ltd,30-Sep-03,29-Apr-13,Cancelled
SA DFEEST,234,Comskil Incorporated,30-Apr-98,30-Apr-02,Non-Current
SA DFEEST,236,Workers Educational Association,1-Jan-97,30-Jun-99,Non-Current
SA DFEEST,238,Holden Ltd,10-Dec-98,31-Dec-03,Non-Current
SA DFEEST,239,Avago Employment Programme Inc,30-Jun-98,30-Jun-01,Non-Current
ASQA,240,Heta Incorporated,1-Oct-12,30-Sep-17,Current
ASQA,241,Australian Institute of Management (SA Division) Inc,5-Sep-03,1-Oct-14,Cancelled
SA DFEEST,243,Eastside SA Inc,16-Apr-03,31-Mar-08,Non-Current
ASQA,246,Australian Broadcasting Corporation,5-Dec-03,13-Sep-11,Non-Current
ASQA,247,Davenpark Pty Ltd,18-Mar-03,31-Dec-13,Non-Current
ASQA,249,MVJ Enterprises Pty Ltd,1-Dec-12,30-Nov-17,Current
WA TAC,250,Albany and Districts Skillshare,30-Sep-94,31-Dec-01,Non-Current
WA TAC,251,Armadale Regional Training Services Inc (Skillshare),24-Jun-94,30-Jun-96,Non-Current
WA TAC,252,Maddington Skillshare/Maddington Training Centre Inc,24-Jun-94,30-Jun-96,Non-Current
WA TAC,253,Melville Skillshare,24-Jun-94,30-Jun-96,Non-Current
WA TAC,254,Community First International Ltd,9-Nov-95,30-Sep-14,Non-Current
WA TAC,255,Eastern Pilbara College of TAFE (refer to Pilbara College),9-Nov-95,31-May-96,Cancelled
WA TAC,257,Western Pacific Consulting Group Pty Ltd,14-Dec-95,31-Dec-00,Non-Current
WA TAC,258,Pundulmurra College,25-Oct-96,31-Dec-00,Non-Current
ASQA,260,Chisholm Institute,1-Jul-15,30-Jun-22,Current
ASQA,262,Assembly of God Paradise Inc,1-Jan-15,31-Dec-19,Current
ASQA,264,SA Ambulance Service,1-Jul-14,30-Jun-19,Current
SA DFEEST,265,Civil Construction Skills & Technology Centre Inc,30-Jan-04,29-Jan-09,Non-Current
NSW VETAB,266,Dusseldorp Skills Forum Inc,10-Jun-94,28-May-02,Non-Current
ASQA,269,Think: Colleges Pty Ltd,26-Nov-14,25-Nov-19,Current
NSW VETAB,270,Commercial Diver Training Centre,10-Jun-94,28-May-02,Non-Current
NSW VETAB,271,Chatswood Evening College Inc,1-Jan-95,3-Apr-00,Non-Current
ASQA,273,SAE Institute Pty Ltd,11-Feb-15,10-Feb-20,Current
ASQA,275,TAFE Queensland,1-Sep-13,31-Aug-18,Current
SA DFEEST,277,Port Lincoln SkillShare Training Centre Inc,9-Feb-94,31-Jan-00,Non-Current
QLD DETE,279,The Perfect Fit Institute for Fitness Professionals,1-Jan-98,30-Sep-00,Non-Current
ASQA,281,Jobtrain Pty Ltd,1-Oct-15,30-Sep-22,Current
WA TAC,290,Hospitality In-House Training,27-May-94,31-Dec-96,Non-Current
WA TAC,291,Bassendean Youth Program,26-Aug-94,31-Dec-99,Non-Current
WA TAC,292,Midland Employment And Training Services Inc,9-Nov-95,31-Jul-96,Cancelled
WA TAC,293,Olympia Business Training Centre Inc,15-Jan-98,31-Jul-09,Non-Current
WA TAC,294,"AMRA College of Natural Sciences, The",26-Aug-94,31-Dec-99,Non-Current
ASQA,295,The Australian Montessori Society Inc.,11-Aug-94,31-Jul-12,Non-Current
WA TAC,296,Edith Cowan University - Faculty of Health and Human Services,26-Aug-94,31-Dec-97,Non-Current
WA TAC,297,All Seasons Hotels and Resorts,29-Nov-94,31-Dec-99,Non-Current
ASQA,298,Western Australian Road Transport Association Inc,22-Jun-15,31-Aug-19,Current
WA TAC,300,Roman Catholic Archbishop of Perth,12-Feb-15,31-May-19,Current
WA TAC,301,Geraldton Regional Community Education Centre Inc.,1-Oct-03,31-Oct-08,Cancelled
WA TAC,302,Derby/West Kimberley Skillshare,31-May-96,31-Dec-00,Cancelled
WA TAC,305,Jobs South West Inc,14-Mar-13,31-Oct-17,Current
ASQA,306,Bendigo Kangan Institute,1-Jul-15,30-Jun-22,Current
NSW VETAB,308,Imageword,1-Jan-97,28-May-02,Non-Current
NSW VETAB,311,Barton Professional Training & Development,12-Aug-94,11-Aug-97,Non-Current
NSW VETAB,314,Containers Packaging,5-Sep-94,4-Sep-97,Non-Current
NSW VETAB,315,About Face & Hair Pty Ltd,12-Aug-94,29-Aug-00,Non-Current
NSW VETAB,317,Blue Circle Southern Cement Ltd,24-Aug-94,23-Aug-97,Non-Current
NSW VETAB,318,Carlton & United Breweries (NSW) Pty Ltd,25-Aug-92,24-Aug-97,Non-Current
NSW VETAB,324,NSW Retail & Wholesale Industry Training Council Ltd,9-Jul-97,6-May-02,Non-Current
NSW VETAB,326,Australian Trade Union Training Authority,10-Jun-92,9-Jun-97,Non-Current
ASQA,328,"Trustee for the Salvation Army (NSW) Property Trust, The",4-Nov-13,3-Nov-18,Current
NSW VETAB,329,Board of Adult & Community Education (NSW),1-Jul-94,7-Aug-00,Non-Current
NSW VETAB,332,"Shell Co of Australia Ltd NSW, The",14-Oct-92,13-Oct-97,Non-Current
NSW VETAB,334,Northern Training Consultants,14-Oct-92,13-Oct-97,Non-Current
NSW VETAB,335,Jack Newton Golf Academy (Australia) Pty Ltd,14-Oct-94,6-Jan-00,Non-Current
SA DFEEST,340,Caitlin Investments Pty Ltd,1-Apr-99,31-Mar-04,Non-Current
NSW VETAB,341,Neilton Business College,1-Jan-98,19-Jun-02,Non-Current
ACT DET,342,ACT Emergency Services Authority,5-Jan-94,23-Sep-04,Non-Current
ACT DET,344,Capital Region Enterprise and Employment Development Association Incorporated (CREEDA),1-Sep-93,9-May-02,Non-Current
NSW VETAB,351,Martin Ridge & Associates Pty Ltd,17-Feb-97,18-Jun-02,Non-Current
WA TAC,353,Pilbara Institute,29-Jan-14,31-Dec-18,Current
WA TAC,354,Lorna June Woods,8-Sep-94,16-Jul-08,Non-Current
ASQA,355,Australian Institute of Holistic Medicine Pty Ltd,8-Sep-94,30-Nov-15,Cancelled
WA TAC,356,Department for Community Development,7-Dec-00,31-Mar-04,Non-Current
WA TAC,357,EMT Emergency Care Consultants Pty Ltd,16-Nov-00,31-Dec-03,Non-Current
WA TAC,359,Police Department of Western Australia,30-Sep-94,31-Dec-99,Non-Current
WA TAC,360,Suzie Craddock's International College of Beauty Therapy,30-Sep-94,31-Dec-99,Non-Current
ASQA,361,Skill Hire WA Pty Ltd,1-May-14,30-Apr-19,Current
WA TAC,362,Albany Worklink Inc,11-Jul-13,30-Nov-17,Current
WA TAC,363,Aerotechnical Skills College,24-Jun-94,31-Dec-99,Non-Current
WA TAC,364,Carnarvon Skillshare,21-May-93,31-Dec-98,Non-Current
ASQA,366,GEM College of International Business (Australia) Pty Ltd,31-Aug-14,30-Aug-19,Current
QLD DETE,369,Citc Stanwell Skills Development Programme Association Branch Inc,1-Jan-98,30-Sep-00,Non-Current
QLD DETE,370,Brewal Pty Ltd as Trustee for the W and V Shepherd Family Trust,1-Jan-98,19-Jun-07,Non-Current
NT DET,371,International Project Management Unit,4-Jan-93,31-Mar-99,Non-Current
ASQA,373,Charles Darwin University,1-Jul-11,31-Dec-16,Current
NT DET,374,Centralian College,1-Jan-92,31-May-04,Non-Current
NT DET,375,Northern Territory Rural College,2-Jan-92,31-Dec-01,Non-Current
ASQA,376,Council for Aboriginal Alcohol Program Services,1-Feb-95,31-Mar-14,Cancelled
NT DET,378,Groote Eylandt Mining Co Pty Ltd,1-Jan-92,31-Jan-04,Non-Current
NT DET,379,Darwin Skills Development Scheme Inc,1-Mar-99,24-Nov-10,Non-Current
NT DET,380,ASSET Training Inc,10-Jan-96,30-Sep-99,Non-Current
ASQA,381,Top End Group Training Pty Ltd,1-Jul-12,30-Jun-17,Current
ASQA,382,Real Estate Institute of the Northern Territory Inc,1-Oct-12,30-Sep-17,Current
ASQA,383,Batchelor Institute of Indigenous Tertiary Education,1-Jul-11,31-Dec-16,Current
ASQA,384,"Police, Fire and Emergency Services",24-Apr-13,23-Apr-18,Current
ASQA,385,Department of Health and Community Services (NT),1-Dec-13,30-Nov-18,Current
WA TAC,386,Hospitality Group Training (WA) Inc,14-Aug-14,31-May-19,Current
WA TAC,387,Wangara Skillshare,30-Sep-94,31-Dec-99,Non-Current
WA TAC,388,Morrison Consulting and Training Pty Ltd,7-Dec-00,31-Dec-03,Non-Current
ASQA,389,Manageering Pty Ltd,20-Sep-13,19-Sep-18,Current
WA TAC,391,Lady Gowrie Centre (WA) Inc - Perth,29-Nov-94,31-Dec-95,Non-Current
WA TAC,392,St John Ambulance (Western Australia) Ltd,11-Apr-13,30-Apr-18,Current
WA TAC,393,Marr Mooditj Training Inc,15-May-14,30-Apr-19,Current
WA TAC,394,Kimberley Aboriginal Medical Services Council (Broome),29-Nov-94,31-Dec-99,Non-Current
WA TAC,395,Ngaanyatjarra Health Service (Aboriginal Corporation),3-Apr-03,30-Apr-08,Cancelled
WA TAC,396,Pamela Joy Sistrunk,10-Nov-94,30-Sep-07,Non-Current
ASQA,397,Department of Parks and Wildlife,1-Jun-14,31-May-19,Current
Tas TQA,400,Department of Administrative Services,8-Jan-94,31-Dec-94,Non-Current
Tas TQA,403,Tasmanian Chamber of Commerce and Industry Limited,3-May-05,26-Aug-09,Non-Current
Tas TQA,404,Colony 47 Inc SkillShare,1-Sep-94,31-Dec-00,Non-Current
Tas TQA,405,Glenorchy SkillShare Training Services,29-Sep-98,11-Oct-00,Cancelled
Tas TQA,407,National Australia Bank,19-May-93,31-Dec-95,Non-Current
Tas TQA,408,Leven Training Centre Inc,6-Jan-93,31-Dec-01,Non-Current
Tas TQA,409,ITeC Tasmania,1-Jan-93,31-Dec-00,Non-Current
Tas TQA,410,Fletcher Challenge Paper Mills (Australia) Ltd,15-Dec-99,14-Dec-04,Non-Current
Tas TQA,411,Mersey Skill Training Inc,17-Feb-04,11-Dec-09,Non-Current
ASQA,412,The Real Estate Institute of Tasmania,22-Sep-14,21-Sep-19,Current
Tas TQA,413,Claremont College,27-Oct-04,21-Jun-08,Non-Current
ASQA,416,Holmesglen Institute,1-Jul-15,30-Jun-22,Current
ASQA,417,Federation Training,1-Jul-15,30-Jun-22,Current
ASQA,418,TAFE Queensland,31-Oct-12,30-Oct-17,Current
QLD DETE,421,"RACHOW, LEIGH DIANNE",1-Jan-98,10-Jul-09,Non-Current
QLD DETE,422,WORKLEARN,1-Jan-98,21-May-06,Non-Current
QLD DETE,423,Queensland University of Technology,1-Jan-98,27-Nov-09,Non-Current
QLD DETE,424,Wide Bay Group Training Scheme Ltd,1-Jan-98,31-Dec-00,Non-Current
QLD DETE,425,Australian College of Natural Medicine Pty Ltd,1-Jan-98,21-Oct-08,Non-Current
QLD DETE,426,United Business Services Pty Ltd,1-Jan-98,31-Dec-01,Non-Current
ASQA,427,SARINA RUSSO SCHOOLS AUSTRALIA PTY LTD,29-Jun-12,17-Dec-16,Current
QLD DETE,428,South Burnett Community Training Centre Inc,1-Jan-98,8-Apr-01,Non-Current
QLD DETE,430,Emerald Agricultural College Board,1-Jan-98,16-Dec-06,Non-Current
QLD DETE,432,Tridec Pty Ltd T/A National College of Neuro-linguistic Communication,1-Jan-98,30-Sep-00,Non-Current
QLD DETE,435,Gumnuts Horse Riding Resort,1-Jan-98,30-Sep-00,Non-Current
QLD DETE,436,QANTAS Airways Ltd,1-Jan-98,17-Sep-02,Non-Current
QLD DETE,437,Dalby Agricultural College Board,1-Jan-98,16-Jan-07,Non-Current
ASQA,438,Central Queensland University,1-Jan-98,1-Dec-14,Cancelled
QLD DETE,439,RM. C. N. M. PTY LTD,1-Jan-98,18-Mar-11,Non-Current
ASQA,441,CALOOLA FARM,10-Jan-94,26-Nov-13,Cancelled
ASQA,442,Department of Defence,1-Dec-13,30-Nov-18,Current
ACT DET,443,Australian College of Pharmacy Practice,1-Jan-95,23-Sep-05,Non-Current
ACT DET,445,Department of Veterans' Affairs (ACT),12-Jan-94,1-Jan-00,Non-Current
ACT DET,446,Community and Youth Sector Training Council Inc,1-Jan-95,31-Aug-07,Non-Current
ACT DET,447,Totalcare Industries Limited,1-Jan-94,1-Mar-02,Non-Current
ASQA,449,"Youth With A Mission, Canberra Inc",13-May-12,12-May-17,Current
ACT DET,450,"Department of Education, Training and Youth Affairs (DETYA)",17-Mar-97,31-Dec-99,Non-Current
ASQA,452,The Pharmacy Guild of Australia,2-Apr-12,1-Apr-17,Current
NSW VETAB,458,"School Education, Department of",5-Dec-94,30-Jun-00,Non-Current
NSW VETAB,461,Wivenhoe Vocational College,2-Dec-94,1-Dec-97,Non-Current
NSW VETAB,464,G P Traders Pty Ltd,2-Dec-94,31-Jul-04,Non-Current
ASQA,469,SMC Pneumatics Australia Pty Ltd,1-Jul-11,6-Jun-16,Current
NSW VETAB,470,"Presbyterian Church (NSW) Property Trust, The",14-Oct-94,10-Apr-02,Non-Current
NSW VETAB,472,Australian Professional Colour Laboratories Association,10-Jun-92,9-Jun-97,Non-Current
NSW VETAB,481,"William Blue Hotel Management School, The",1-Jan-95,31-Dec-00,Non-Current
ASQA,485,Mobile Welding Services Pty Ltd,1-Sep-15,31-Aug-22,Current
NSW VETAB,486,Academy of Scientific Beauty,1-Jan-95,7-Aug-00,Non-Current
NSW VETAB,489,Educational Horizons Pty Ltd,5-Aug-97,4-Dec-00,Non-Current
NSW VETAB,497,NSW Board of Studies,23-Dec-94,22-Dec-97,Non-Current
NSW VETAB,499,O'Brien Glass Industries Ltd,1-Jan-95,30-Jun-00,Non-Current
ASQA,500,Navitas Professional Institute Pty Ltd,14-Dec-12,13-Dec-17,Current
NSW VETAB,501,ACCESS Competency Recognition Services,1-Jan-95,30-Jun-00,Non-Current
NSW VETAB,502,Kangaroo Valley Public School,13-Apr-94,12-Apr-99,Non-Current
NSW VETAB,511,Insearch Ltd,7-Jun-95,30-May-04,Non-Current
NSW VETAB,512,WSROC Training & Employment,1-Jan-95,5-Apr-08,Non-Current
NSW VETAB,515,St Edmunds School for Blind & Visually Impaired Students,2-Dec-94,1-Dec-97,Non-Current
NSW VETAB,516,"Athlete's Foot Australia Pty Ltd, The",2-Dec-92,1-Dec-97,Non-Current
ASQA,518,The Roman Catholic Church Trust Corporation of the Archdiocese of Hobart,9-Jan-14,8-Jan-19,Current
Tas TQA,520,Launceston College,27-Oct-04,21-Jun-08,Non-Current
Tas TQA,521,Elizabeth College,13-Dec-04,21-Jun-08,Non-Current
Tas TQA,522,Australian Services Union,1-Jan-95,31-Dec-99,Non-Current
Tas TQA,523,Australian Liquor Hospitality & Miscellaneous Workers Union,1-Jan-95,31-Dec-99,Non-Current
QLD DETE,525,Helyna Monica May Burton,1-Jan-98,20-Aug-08,Non-Current
ASQA,526,TAFE Queensland,27-Aug-12,26-Aug-17,Current
QLD DETE,527,The Moreland Group,1-Jan-98,12-Aug-01,Non-Current
QLD DETE,528,Gold Coast City Council,1-Jan-98,30-Mar-01,Non-Current
QLD DETE,534,Liberty Ministry College,1-Jan-98,30-Sep-05,Non-Current
QLD DETE,536,Australian Red Cross Society,1-Jan-98,30-Sep-05,Non-Current
QLD DETE,537,Australian College of Tropical Agriculture,1-Jan-98,31-Oct-05,Non-Current
QLD DETE,538,Greening Australia Queensland (Inc),1-Jan-98,21-Oct-08,Non-Current
QLD DETE,539,P.T.C. Pty.Ltd.,1-Jan-98,30-Mar-10,Non-Current
QLD DETE,540,EHLE AUSTRALIA PTY. LTD.,1-Jan-98,21-Jun-07,Non-Current
QLD DETE,541,Department of Employment and Training,1-Jan-98,31-Dec-02,Non-Current
ASQA,542,TAFE Queensland,29-Jun-12,20-Feb-17,Current
ASQA,543,Skills Training Mackay Association Incorporated,1-Sep-12,31-Aug-17,Current
ASQA,546,Royal Australian Air Force,1-Jun-14,31-May-19,Current
ACT DET,548,AusAID,18-Oct-95,31-Dec-00,Non-Current
ACT DET,550,Department of Immigration and Ethnic Affairs,1-Jan-97,31-Dec-00,Non-Current
ACT DET,551,Department of Finance and Administration,1-Dec-94,31-Dec-00,Non-Current
ACT DET,552,Department of Family and Community Services,1-Jan-97,31-Dec-00,Non-Current
ACT DET,554,Department of Communication and the Arts,1-Jan-97,31-Dec-00,Non-Current
ASQA,561,Minister for Education and Children's Services,1-Jan-14,31-Dec-18,Current
SA DFEEST,564,Forum International Services Pty Ltd,1-Jan-95,31-Jan-00,Non-Current
SA DFEEST,567,Southcorp Australia Pty Ltd,1-Jan-95,30-Jun-99,Non-Current
ASQA,569,The Maxima Group Incorporated,26-Mar-12,29-Sep-16,Current
SA DFEEST,570,Kathryn Dean,19-Dec-03,31-Dec-06,Non-Current
SA DFEEST,571,Best Centre,1-Jan-99,31-Dec-00,Non-Current
ASQA,573,South Australian Metropolitan Fire Service,31-Mar-15,30-Mar-22,Current
SA DFEEST,574,South Eastern Employment Resource Development Enterprise Inc,30-Sep-96,31-Jan-00,Non-Current
ASQA,575,SA College of Natural Medicine Pty Ltd,22-Feb-94,7-Jan-13,Cancelled
SA DFEEST,576,Inner Western Workskills Inc,1-Jul-99,30-Jun-04,Non-Current
ASQA,577,Logging Investigation and Training Association Inc,31-Mar-15,30-Mar-20,Current
SA DFEEST,578,Port Adelaide Information Technology Centre,30-Jul-96,30-Jun-99,Non-Current
SA DFEEST,579,LSH and Associates Pty Ltd,1-Apr-95,30-Jun-99,Non-Current
SA DFEEST,580,Training and Licensing Centre Inc,4-Dec-02,4-Dec-07,Non-Current
ASQA,581,Heavy Equipment Training and Assessment Pty Ltd,8-Nov-13,7-Nov-18,Current
SA DFEEST,582,Adelaide Forklift Training Centre Pty Ltd,18-Dec-02,14-Feb-11,Non-Current
NT DET,583,Australian Red Cross NT Division,1-Apr-01,31-Mar-04,Non-Current
NT DET,584,Danila Dilba Biluru Butji Binnilutlum Health Service Aboriginal Corporation,1-Jan-99,31-Mar-07,Non-Current
NT DET,585,SIL Darwin Incorporated,1-Jan-99,30-Apr-05,Non-Current
NSW VETAB,587,Bonnyrigg Skillshare,1-Jan-98,23-Nov-01,Non-Current
ASQA,590,AMES Australia,1-Dec-14,30-Nov-19,Current
WA TAC,592,OTRACO (International) Pty Ltd,27-May-94,31-Dec-99,Non-Current
ASQA,594,Perth Institute of Business and Technology Pty Ltd,4-Dec-12,3-Dec-17,Current
WA TAC,595,Edwards College Pty Ltd,29-Nov-94,31-Dec-99,Non-Current
WA TAC,596,Swan Brewery,16-Dec-94,31-Dec-00,Non-Current
WA TAC,597,Perth Japanese Language Academy Pty Ltd,16-Dec-94,31-Dec-99,Non-Current
WA TAC,598,Churches of Christ Homes and Community Services Inc,16-Dec-94,31-Dec-99,Non-Current
WA TAC,599,Target Australia - WA,14-Mar-97,19-Mar-01,Non-Current
WA TAC,600,Yorkglen Holdings Pty Ltd trading as Charles Fitzgerald & Associates,7-Dec-00,31-Mar-04,Non-Current
WA TAC,601,Plastics and Rubber Technology Centre,14-Mar-97,31-Dec-01,Non-Current
WA TAC,602,Tyco Services,9-Dec-99,28-Feb-00,Non-Current
WA TAC,603,Risk Management Technologies Pty Ltd,29-Nov-94,31-Dec-99,Non-Current
WA TAC,604,City of Melville,3-Feb-00,30-Sep-03,Non-Current
WA TAC,605,Edwards Manufacturing,16-Dec-94,31-Dec-98,Cancelled
WA TAC,606,Esperance Farm Training Centre,16-Dec-94,31-Dec-99,Non-Current
WA TAC,607,Castleway Nominees Pty Ltd,21-Aug-02,30-Sep-07,Non-Current
WA TAC,608,Step 1 Inc,14-May-97,31-Dec-01,Cancelled
WA TAC,609,Amana Living Incorporated,30-Jan-13,30-Nov-17,Current
WA TAC,610,PEP Community Services,26-Aug-09,31-Aug-14,Cancelled
WA TAC,612,REPCO Auto-Tech,24-Jun-94,31-Dec-96,Non-Current
WA TAC,614,ETC: Education & Training Consultants,16-Nov-00,31-Dec-03,Non-Current
WA TAC,619,Peter and Janet McCracken,7-Dec-00,31-Dec-03,Non-Current
WA TAC,621,Ministry of the Premier and Cabinet,14-Sep-95,31-Dec-00,Non-Current
WA TAC,622,Judith Crossland Academy,7-Dec-00,31-Dec-03,Cancelled
WA TAC,623,Federation of WA Police & Citizens Youth Clubs Inc,1-Jan-97,31-Dec-97,Non-Current
WA TAC,624,Curtin University of Technology,24-Feb-95,31-Dec-00,Cancelled
WA TAC,626,HIA Services (WA) Pty Ltd,1-Jan-97,31-Dec-97,Non-Current
WA TAC,627,Automotive Institute of Technology Incorporated,8-Aug-13,31-Jul-18,Current
WA TAC,628,Australian Organisation for Quality Ltd (WA),31-Mar-95,31-Dec-98,Non-Current
WA TAC,630,Western Australian Police Force/Service,14-Mar-97,31-Oct-00,Non-Current
WA TAC,631,Cocos (Keeling) Islands Administration,31-Mar-95,31-Dec-98,Non-Current
WA TAC,632,Australia International Catering College,20-Dec-96,30-Sep-00,Non-Current
NSW VETAB,640,University of Western Sydney Hawkesbury Language Centre Insearch Language Centre,26-Aug-98,5-Jun-00,Non-Current
NSW VETAB,642,"Scout Association of Australia, The",11-Aug-96,10-Aug-01,Non-Current
SA DFEEST,643,NASTEC Solutions,23-Dec-98,30-Apr-01,Non-Current
ASQA,644,Nganampa Health Council Inc,1-Jan-14,31-Dec-18,Current
ASQA,645,Department for Correctional Services,31-Dec-14,30-Dec-19,Current
ASQA,646,Master Builders Association SA Inc,13-Nov-12,12-Nov-17,Current
ASQA,647,Construction Industry Training Centre Inc,1-Nov-12,31-Oct-17,Current
SA DFEEST,648,Offenders Aid & Rehabilitation Services of SA Inc,23-Apr-98,31-Dec-03,Non-Current
ASQA,649,Australian Fisheries Academy Ltd,31-Mar-14,30-Mar-19,Current
ASQA,650,Nexus Recruitment Pty Ltd,25-Jul-03,24-Jul-13,Cancelled
ASQA,653,Top Office Personnel Pty Ltd,29-Jun-12,18-Mar-23,Current
QLD DETE,654,Cairns Career Training Incorporated,1-Jan-98,30-Sep-00,Non-Current
QLD DETE,655,Buckingham Model and Personal Development Training,1-Jan-98,30-Sep-00,Non-Current
