RCAB,Code,Name,Start Date,End Date,Status
Vic VRQA,3794,Alison Jean Walker,1-Mar-95,14-Jul-05,Non-Current
Vic VRQA,3796,Employment 2000 Plenty Valley,1-Apr-97,30-Apr-00,Non-Current
Vic VRQA,3797,Engineering Education Aust,1-Dec-97,13-Sep-00,Non-Current
ASQA,3798,College of Fashion Design Pty Ltd,1-Dec-13,30-Nov-18,Current
Vic VRQA,3799,Environmental Health Services (Aust) Pty Ltd,1-Dec-96,31-Dec-04,Non-Current
Vic VRQA,3802,Essendon Network for Employment & Training Inc,1-Dec-95,15-Dec-09,Non-Current
Vic VRQA,3803,ESSO Australia Ltd,8-Jun-01,27-May-05,Non-Current
Vic VRQA,3806,F J Yeh Pty Ltd,1-Oct-96,29-Mar-10,Non-Current
Vic VRQA,3807,Festo Pty Ltd,1-Jan-96,31-Jan-04,Non-Current
ASQA,3809,Fire Safety Training & Management Services Pty Ltd,1-Jun-96,11-Jul-14,Cancelled
Vic VRQA,3810,Fisher - Rosemount Pty Ltd,9-Jan-96,6-Nov-00,Non-Current
Vic VRQA,3811,Fitzroy Learning Network Inc,1-Dec-92,30-May-20,Current
Vic VRQA,3812,Flemington Reading and Writing Program Inc,1-Dec-92,26-Sep-08,Non-Current
Vic VRQA,3813,Focus Consulting (Vic) Pty Ltd,1-Mar-97,9-Jun-05,Non-Current
Vic VRQA,3814,Food Industry Training  Ltd,1-Dec-96,31-Dec-04,Non-Current
Vic VRQA,3817,Infosentials Limited,1-Jun-97,1-Jun-01,Non-Current
Vic VRQA,3818,Olympic Adult Education Inc,1-Oct-15,30-Sep-20,Current
Vic VRQA,3819,Future Connections Association Inc,1-Dec-92,5-Jun-08,Non-Current
Vic VRQA,3820,G & H Training Pty Ltd,1-Apr-98,30-Apr-05,Non-Current
ASQA,3821,National Food Institute Pty Ltd,1-Jun-15,31-May-20,Current
Vic VRQA,3823,Geelong Adult Training & Education Inc,1-May-96,26-Mar-10,Non-Current
Vic VRQA,3826,Geoffrey Murdoch Rural Community Opportunities,1-May-97,18-Aug-99,Non-Current
Vic VRQA,3827,Islefield Pty Ltd,1-Jan-98,27-May-05,Non-Current
Vic VRQA,3828,Gippsland Employment Skills Training Inc,1-Dec-92,31-Dec-20,Current
Vic VRQA,3829,Gippsland Group Training Ltd,1-Oct-93,31-Oct-20,Current
Vic VRQA,3831,Glenroy Neighbourhood Learning Centre Inc,1-Nov-05,31-Oct-20,Current
ASQA,3832,GM Holden Ltd,2-Nov-14,1-Nov-19,Current
Vic VRQA,3833,Godfrey Hirst Australia Pty Ltd,1-Sep-96,24-Nov-05,Non-Current
Vic VRQA,3834,Victorian Vocational Rehabilitation Association,1-Mar-97,30-Apr-20,Current
Vic VRQA,3835,Goulburn Murray Rural Water Corporation,1-Apr-92,11-Apr-14,Cancelled
ASQA,3836,Goulburn Administration Services Limited (In Liquidation),1-Aug-13,31-Jul-18,Current
Vic VRQA,3838,Grassmere Youth Services,1-Nov-97,13-Sep-00,Non-Current
ASQA,3839,Gray Management Systems Pty Ltd,1-Jul-15,30-Jun-20,Current
Vic VRQA,3840,Greater City Geelong Council,1-Aug-97,13-Sep-00,Non-Current
Vic VRQA,3841,Greening Australia Victoria Inc,1-Apr-98,30-Apr-05,Non-Current
ASQA,3843,Australian Business Colleges Pty Ltd,1-Nov-92,31-Jul-14,Cancelled
Vic VRQA,3845,Hamilton Region 2000 Inc,1-Oct-96,15-Nov-00,Non-Current
Vic VRQA,3849,Hawthorn Community House Inc,1-Dec-96,21-Dec-11,Cancelled
Vic VRQA,3850,RAAF Headquarters Training Command,1-Jun-95,30-Jun-03,Non-Current
Vic VRQA,3851,Healesville Living and Learning Centre Inc,1-Dec-92,31-Dec-19,Current
Vic VRQA,3852,Department of Human Services - Disability Services Training Unit,1-Mar-96,31-Mar-04,Non-Current
Vic VRQA,3853,Health Services Union of Australia,1-Mar-95,31-Mar-09,Non-Current
Vic VRQA,3854,Heidelberg Training and Resource Centre Inc,1-Jun-95,30-Jun-19,Current
Vic VRQA,3855,HRA Pty Ltd,30-Jun-08,30-Jun-18,Current
Vic VRQA,3856,Hendersons Automotive Technologies Pty Ltd,1-Jul-95,11-May-06,Non-Current
Vic VRQA,3857,Henshall Mammolito Pty Ltd,1-Sep-96,9-Oct-00,Non-Current
ASQA,3862,Wimmera Hub Inc,1-Dec-92,16-Mar-15,Cancelled
Vic VRQA,3865,Hospitality Group Training Victoria Inc,1-Feb-96,7-May-01,Non-Current
Vic VRQA,3867,Hume Employment and Training Inc,1-Nov-05,31-Oct-20,Current
ASQA,3868,Hungry Jack's Pty Ltd,1-Feb-93,28-Feb-15,Non-Current
Vic VRQA,3869,Huntsman Chemical Company Australia Pty Limited,1-Aug-95,31-Aug-03,Non-Current
Vic VRQA,3870,PPG Industries Australia  Pty Ltd,1-Dec-98,7-Jul-01,Non-Current
Vic VRQA,3871,Norgren Pty Ltd,1-Mar-93,31-Mar-10,Non-Current
Vic VRQA,3872,Victorian Institute of Managment,31-Dec-08,31-Jan-20,Current
Vic VRQA,3874,Inner Northern Group Training  Ltd,1-Apr-93,30-Apr-20,Current
ASQA,3875,Innovative Business Training Pty Ltd,1-May-15,30-Apr-20,Current
Vic VRQA,3876,"Department of Primary Industries, Knoxfield",1-Sep-95,30-Sep-14,Non-Current
ASQA,3877,International Security Training Academy Pty Ltd,1-Nov-14,31-Oct-21,Current
Vic VRQA,3878,International Security Training Centre Pty Ltd,1-Aug-97,30-Aug-00,Non-Current
Vic VRQA,3879,J C Consultancy,1-Jun-97,30-Jun-05,Non-Current
Vic VRQA,3880,James C Smith & Associates Pty Ltd,1-Sep-96,31-Aug-05,Non-Current
Vic VRQA,3881,James Harrison  College,1-Jun-97,30-Jun-05,Non-Current
Vic VRQA,3882,Murcotts Driving Excellence Pty Ltd,7-Mar-03,11-May-06,Non-Current
Vic VRQA,3887,Qenos Pty Ltd,1-Apr-93,30-Apr-15,Non-Current
Vic VRQA,3888,Kensington Neighbourhood House Inc,1-Dec-92,31-Dec-14,Cancelled
Vic VRQA,3889,Kerang Learning Centre Inc,1-Dec-92,31-Dec-14,Cancelled
Vic VRQA,3890,Resurrection Catholic Church Keysborough,1-Dec-92,31-Dec-19,Current
ASQA,3891,Australian College of Complementary Medicine Pty Ltd,1-Apr-97,29-Mar-15,Non-Current
Vic VRQA,3893,Kmart,1-Jan-97,31-Jan-05,Non-Current
Vic VRQA,3896,Kraft Foods Ltd,1-Mar-95,15-Jun-06,Non-Current
Vic VRQA,3897,Kyabram Community & Learning Centre Inc,1-Dec-93,2-Feb-16,Cancelled
Vic VRQA,3898,Kyneton District Employment & Support Services Inc,1-Feb-96,28-Feb-99,Non-Current
ASQA,3899,La Trobe University,1-Oct-15,30-Sep-22,Current
ASQA,3900,Lady Gowrie Child Centre Melbourne Inc,1-Jul-15,30-Jun-22,Current
Vic VRQA,3902,Lalor Living and Learning Centre Inc,1-Dec-92,31-Dec-19,Current
Vic VRQA,3904,Laminex Industries,1-Sep-96,30-Sep-02,Non-Current
Vic VRQA,3905,George AH Lang's Business College Ltd,1-Jan-97,31-Jan-05,Non-Current
Vic VRQA,3907,Lavin Australia Pty Ltd,1-Sep-97,14-Jul-00,Non-Current
ASQA,3908,Leadership Management Australia Pty Ltd,1-Jun-15,31-May-22,Current
Vic VRQA,3909,Achieveglobal Pty Ltd,1-Mar-97,28-Feb-05,Non-Current
ASQA,3910,Smart Connection Company Pty Ltd,1-Feb-15,31-Jan-22,Current
Vic VRQA,3911,Linda Wyse and Associates Pty Ltd,1-Sep-93,30-Sep-20,Current
ASQA,3912,Link Employment and Training Inc,1-Oct-95,31-Oct-15,Non-Current
Vic VRQA,3913,Living and Learning Inc,30-Sep-07,30-Sep-17,Current
Vic VRQA,3915,Lowanna College,1-Aug-96,13-Feb-06,Non-Current
Vic VRQA,3918,Lyndhurst Secondary College,1-Feb-93,13-Nov-07,Non-Current
Vic VRQA,3920,Macedon Ranges Further Education Centre Inc,30-Apr-08,30-Apr-18,Current
Vic VRQA,3922,Australian International College of Tourism and Commerce Pty Ltd,1-May-96,31-May-04,Non-Current
ASQA,3923,Macquarie Commercial College Ltd,1-Jan-14,31-Dec-18,Current
Vic VRQA,3924,Madame Korner College - Melbourne,1-Mar-96,31-Mar-99,Non-Current
Vic VRQA,3925,Maffra Community Resource Centre Inc,1-May-96,31-May-99,Non-Current
Vic VRQA,3926,Maharishi's Global Administration Through Natural Law Ltd,1-Jul-96,31-Jul-04,Non-Current
ASQA,3927,The Management Edge Pty Ltd,1-Oct-15,30-Sep-22,Current
Vic VRQA,3928,Mansfield Adult Continuing Education Inc,1-Dec-92,31-Dec-19,Current
ASQA,3930,Milneworth Pty Ltd,1-Jun-14,31-May-19,Current
Vic VRQA,3932,Maryborough Learning Centre,1-Jul-94,12-Oct-03,Non-Current
Vic VRQA,3934,Maryborough Regional Education & Training Services,1-Jan-97,31-Jan-05,Non-Current
ASQA,3935,Master Builders Association of Victoria,3-Feb-14,2-Feb-19,Current
Vic VRQA,3936,"Master Painters Association of Vic Ltd, The",1-May-97,31-May-05,Non-Current
Vic VRQA,3937,Master Plumbers' & Mechanical Services Association of Australia,1-Jun-92,30-Jun-19,Current
ASQA,3938,Mayfield Education Inc,11-Sep-14,10-Sep-19,Current
Vic VRQA,3939,Mazda Australia Pty Ltd (VIC),1-Apr-92,30-Apr-10,Non-Current
Vic VRQA,3940,Meadow Heights Learning Shop Inc,1-Feb-97,30-Jun-20,Current
Vic VRQA,3941,Melba Memorial Conservatorium of Music,1-Apr-96,30-Apr-04,Non-Current
Vic VRQA,3942,Melbourne City Business Network Ltd,1-Oct-97,23-Oct-00,Non-Current
Vic VRQA,3943,Melbourne College of Hairdressing & Beauty Culture Pty Ltd,4-Apr-06,7-Jun-07,Non-Current
ASQA,3945,MEGT (Australia) Ltd,1-Apr-14,31-Mar-19,Current
ASQA,3946,Melbourne Institute of Business and Technology Pty Ltd,18-Dec-13,17-Dec-18,Current
Vic VRQA,3947,Melbourne Language Centre Pty Ltd,1-Dec-96,31-Dec-04,Non-Current
ASQA,3948,Melbourne Rudolf Steiner Seminar Limited,14-Nov-14,13-Nov-19,Current
Vic VRQA,3949,Melbourne School of Art,6-Jan-96,30-Jun-04,Non-Current
Vic VRQA,3952,Merinda Park Learning and Community Centre Inc,1-Aug-95,31-Aug-19,Current
Vic VRQA,3954,Methodist Ladies College Ltd,1-Dec-96,31-Dec-04,Non-Current
Vic VRQA,3956,Michele Green Training Consultancy,1-Jul-95,31-Jul-03,Non-Current
ASQA,3957,MADEC Australia,1-Mar-14,28-Feb-19,Current
Vic VRQA,3961,Mobil Oil Australia Ltd,1-Aug-98,31-Aug-03,Non-Current
Vic VRQA,3962,Mt Eliza Graduate School of Business and Government Ltd,1-Jun-93,24-Nov-05,Non-Current
Vic VRQA,3963,Moonee Valley City Council,1-Jun-97,30-Jun-05,Non-Current
Vic VRQA,3964,Moreland Adult Education Association Inc,1-Oct-05,30-Sep-20,Current
Vic VRQA,3966,Morrison House Inc,1-Sep-95,4-Aug-15,Cancelled
Vic VRQA,3967,Mount Alexander Shire Council,1-Apr-96,23-Jun-05,Non-Current
Vic VRQA,3969,Mountain District Women's Co-operative Ltd,1-May-95,31-May-19,Current
Vic VRQA,3970,Mt Eliza Community Contact Inc,1-Dec-96,25-Sep-03,Non-Current
Vic VRQA,3971,Mount Martha Community Learning Centre Inc.,31-Jan-09,31-Jan-20,Current
ASQA,3974,Murray Mallee Training Company  Ltd,1-May-15,30-Apr-20,Current
ASQA,3975,Murray College of Health Education Pty Ltd,1-Jul-14,30-Jun-19,Current
Vic VRQA,3977,Narre Community Learning Centre Inc,1-Dec-92,31-Dec-20,Current
ASQA,3979,The National Council of the Young Men's Christian Association of Australia,1-May-15,30-Apr-20,Current
Vic VRQA,3980,National Electrical Contractors Association,1-May-97,23-Oct-00,Non-Current
Vic VRQA,3981,Kyane Pty Ltd,1-Nov-95,30-Nov-19,Current
Vic VRQA,3982,Ansec Security Training Academy,1-Sep-97,14-Jul-00,Non-Current
Vic VRQA,3983,National Photo Training College (VIC),1-Oct-97,20-Mar-00,Non-Current
Vic VRQA,3985,Natra Pty Ltd,1-Aug-96,5-Mar-01,Non-Current
ASQA,3986,Natural Enterprises of Australia Pty Ltd,1-Jul-92,30-Aug-13,Cancelled
Vic VRQA,3987,Nestle Echuca Pty Ltd,1-Aug-97,31-Aug-05,Non-Current
Vic VRQA,3988,Nillumbik Adult Education Inc,1-May-96,19-Feb-04,Non-Current
Vic VRQA,3989,Nillumbik Shire Council,1-Dec-92,31-Dec-20,Current
Vic VRQA,3992,North Eastern Region Migrant Resource Centre,1-Dec-96,31-Dec-02,Non-Current
Vic VRQA,3993,North Shepparton Community & Learning Centre Inc,3-Mar-15,28-Feb-20,Current
Vic VRQA,3996,Norwellan Textiles Pty Ltd,1-Jul-96,31-Jul-99,Non-Current
Vic VRQA,3998,One to One Educational Consultancy Pty Ltd,1-May-96,31-May-04,Non-Current
ASQA,3999,Open Channel Co-operative Ltd,1-Sep-14,31-Aug-21,Current
Vic VRQA,4000,Open Learning Agency of Australia Pty Ltd,1-May-96,7-Mar-00,Non-Current
SA DFEEST,40000,Target Ltd,1-Jun-05,21-Jun-08,Non-Current
ASQA,40001,McLaughlan Consulting Pty Ltd,20-Sep-02,31-Jul-14,Cancelled
SA DFEEST,40002,Janet Gloria Webber and Graham Ross Webber,7-Nov-02,7-Nov-07,Non-Current
SA DFEEST,40003,Community Housing Council of SA Inc,7-Oct-99,31-Aug-02,Non-Current
SA DFEEST,40005,Australian Red Cross SA Division,10-Nov-99,31-Oct-02,Non-Current
SA DFEEST,40007,Nayda Pty Ltd,1-Nov-99,31-Oct-02,Non-Current
ASQA,40008,Nursing Agency of Australia Pty Ltd,1-Dec-01,30-Nov-12,Cancelled
ASQA,40009,Careerlink Business Services Pty Ltd,30-Apr-03,30-Nov-13,Cancelled
ASQA,4001,Optec Pty Ltd,1-Jul-11,30-Jun-16,Current
ASQA,40010,Barkuma Inc,10-Sep-12,9-Sep-17,Current
SA DFEEST,40011,Yum! Restaurants Australia Pty Ltd,16-Dec-99,31-Dec-04,Non-Current
ASQA,40012,Cemons Pty Ltd,13-Dec-12,12-Dec-17,Current
SA DFEEST,40014,The Mortgage Company Pty Ltd,23-Dec-99,30-Jun-02,Non-Current
SA DFEEST,40017,Polymer Industries Technology Centre,1-Mar-00,28-Feb-04,Non-Current
SA DFEEST,40018,Logistics Education Centre Ltd,1-Mar-00,30-Dec-09,Non-Current
ASQA,40020,Maryden Pty Ltd,28-Feb-14,27-Feb-19,Current
SA DFEEST,40021,Dalpaz Pty Ltd,1-May-00,30-Sep-02,Non-Current
ASQA,40022,South Australian Country Fire Service,4-Sep-13,3-Sep-18,Current
SA DFEEST,40024,Trevor John O'Brien,8-May-03,26-Mar-07,Non-Current
ASQA,40025,The VAT Group Pty Ltd,1-Nov-02,1-Nov-12,Cancelled
SA DFEEST,40027,Progressive Insight,21-Aug-00,31-Jul-02,Non-Current
ASQA,40029,The Centre for Creative Photography as trustee for The Blake Family Trust,28-Oct-13,27-Oct-18,Current
Vic VRQA,4003,Pacific English Language Training Pty Ltd,3-Jan-97,31-Mar-05,Non-Current
ASQA,40031,Sheila Thiele,11-Dec-02,11-Dec-12,Cancelled
SA DFEEST,40032,International Student Services (SA) Pty Ltd,7-Sep-01,31-Dec-06,Non-Current
ASQA,40033,Insight International Consultancy Pty Ltd,1-Jun-14,31-May-19,Current
SA DFEEST,40034,Academy of Enhanced Performance,13-Oct-00,31-Mar-03,Non-Current
SA DFEEST,40035,SA International Education Consulting Services Pty Ltd,1-Nov-00,31-Oct-02,Non-Current
ASQA,40036,S.A. Adelaide Language Centre,13-Aug-10,3-Dec-13,Cancelled
ASQA,40037,Australian Workplace Training Pty Ltd,1-Nov-13,31-Oct-18,Current
ASQA,40038,The Centre for People Development Pty Ltd,30-Sep-14,29-Sep-19,Current
SA DFEEST,40039,Yarrow Place Rape and Sexual Assault Service,31-Dec-01,30-Dec-09,Non-Current
Vic VRQA,4004,Paddy Spruce & Associates,1-Jun-97,30-Jun-00,Non-Current
SA DFEEST,40041,Sideways Glance Pty Ltd,1-May-01,31-Mar-03,Non-Current
ASQA,40042,Fusion Business Solutions Pty Ltd,31-Jan-14,30-Jan-19,Current
SA DFEEST,40043,BOSS Personnel (Aust) Pty Ltd,1-Apr-01,31-Mar-04,Non-Current
ASQA,40044,South Australian Institute of Business and Technology Pty Ltd,31-Jan-04,31-Mar-14,Cancelled
SA DFEEST,40045,Ensign Services (Aust) Pty Ltd,20-Mar-01,1-Mar-04,Non-Current
ASQA,40046,Minister for Education and Children's Services,23-Nov-12,22-Nov-17,Current
ASQA,40047,Wirraway Homestead Limited,1-May-01,31-Jan-15,Cancelled
SA DFEEST,40048,Safety Management & Resource Training Pty Ltd,1-Jul-01,30-Jun-06,Non-Current
ASQA,40049,YourLife Health and Learning Inc,1-Jan-16,31-Dec-22,Current
Vic VRQA,4005,Pakenham Secondary College,1-Aug-97,3-Nov-99,Non-Current
ASQA,40053,SYC Ltd,1-Jan-14,31-Dec-18,Current
ASQA,40055,Colour Cosmetica Academy Pty Ltd,26-Mar-12,31-Mar-16,Current
ASQA,40056,ARO Educational Services Pty Ltd,1-Oct-14,30-Sep-19,Current
ASQA,40057,Flexible Construction Training and Assessment Pty Ltd,17-Apr-13,16-Apr-18,Current
ASQA,40058,TIME Education and Training Pty Ltd,30-Apr-14,29-Apr-19,Current
SA DFEEST,40059,Strategems Pty Ltd,1-May-01,1-Apr-05,Non-Current
ASQA,40060,Western Pacific Training Consultants Pty Ltd,16-Jul-04,15-Feb-14,Cancelled
ASQA,40061,Educational Services and Consultants Pty Ltd,28-May-14,27-May-19,Current
SA DFEEST,40062,Social Options Australia Pty Ltd,1-May-01,31-May-06,Non-Current
ASQA,40063,Minister for Agriculture Food and Fisheries,1-Aug-03,21-May-13,Cancelled
ASQA,40064,Australian Nursing & Midwifery Federation (SA Branch),1-Sep-12,31-May-17,Current
SA DFEEST,40066,South-East Employment Resource Development Enterprise,1-Nov-01,31-Oct-04,Non-Current
SA DFEEST,40067,Training Statewide Pty Ltd,31-May-04,30-Mar-07,Non-Current
ASQA,40069,ARA Jobs Pty Ltd,10-Oct-03,10-Oct-13,Cancelled
ASQA,4007,Independence Australia Services,5-Feb-15,30-Nov-19,Current
ASQA,40070,Master Plumbers Association of South Australia Incorporated,26-Mar-12,30-Jul-16,Current
SA DFEEST,40071,JR & MD Maney,1-Dec-01,31-Mar-04,Non-Current
SA DFEEST,40072,JET (M) Enterprises Pty Ltd,1-Nov-01,8-Sep-10,Non-Current
SA DFEEST,40073,Interwork Limited,18-Apr-02,18-Oct-06,Non-Current
ASQA,40074,Status Works Pty Ltd,30-Dec-14,28-Jun-19,Current
ASQA,40075,Smith & Georg Pty Ltd,26-Mar-12,30-Nov-16,Current
SA DFEEST,40076,Transfield Services (Australia) Pty Ltd,10-Jul-02,24-Oct-06,Non-Current
SA DFEEST,40077,Charlie Calleja & Olimpia Calleja,31-Oct-04,8-Sep-06,Non-Current
ASQA,40078,Bakas Consultancy Services Pty Ltd,1-Nov-01,31-Oct-11,Non-Current
ASQA,40079,Site Education Australia Pty Ltd,12-Dec-02,12-Dec-12,Non-Current
Vic VRQA,4008,Park Orchards Community House & Learning Centre Inc,1-Nov-96,30-Nov-20,Current
ASQA,40080,The University of Adelaide,1-Dec-01,30-Apr-15,Cancelled
SA DFEEST,40081,RAA Insurance Limited,24-Oct-02,6-Jul-07,Non-Current
SA DFEEST,40082,Beverley Tilbrook,12-Dec-01,31-Dec-02,Non-Current
SA DFEEST,40083,Interdynamics,15-Mar-02,28-Feb-07,Non-Current
SA DFEEST,40084,The Corporation of the City of Marion,1-Dec-01,30-Nov-06,Non-Current
SA DFEEST,40086,Humantra Pty Ltd,15-Mar-02,16-Jun-08,Non-Current
SA DFEEST,40087,The Paraclete Institute Inc,19-Nov-02,19-Nov-07,Non-Current
SA DFEEST,40088,Quality Training Pty Ltd,10-Jul-02,1-Dec-05,Non-Current
SA DFEEST,40089,Harris Scarfe Australia Pty Ltd,17-Apr-02,17-Apr-07,Non-Current
SA DFEEST,40091,Invisage Australia Pty Ltd,24-Jul-02,12-Dec-06,Non-Current
SA DFEEST,40093,EDS Business Process Administration Pty Ltd,22-May-02,10-Nov-05,Non-Current
ASQA,40094,D and C Healey Pty Ltd,1-Nov-12,31-Oct-17,Current
SA DFEEST,40095,Lynn Reid Corporate Pty Ltd,10-Jun-02,10-Jul-07,Non-Current
ASQA,40097,ANMI Nominees Pty Ltd,30-Aug-02,31-Oct-12,Cancelled
SA DFEEST,40099,John Edwin Warren,30-Aug-02,31-Oct-07,Non-Current
ASQA,40101,Access Training Centre Pty Ltd,1-Nov-12,30-Oct-17,Current
ASQA,40102,Connect Asia Pacific Pty Ltd,7-Dec-12,6-Dec-17,Current
ASQA,40103,Nunkuwarrin Yunti of South Australia Inc,6-Feb-13,5-Feb-18,Current
ASQA,40105,Australian Institute of Business Administration Pty Ltd,25-Sep-02,31-Dec-11,Non-Current
SA DFEEST,40106,Danielle Rippin,7-Nov-02,7-Nov-07,Non-Current
ASQA,4011,Pinewood River Pty Ltd,1-Jun-14,8-Jan-19,Current
ASQA,40110,Surf Life Saving South Australia Inc,1-May-13,30-Apr-18,Current
SA DFEEST,40113,SAAB Systems Pty Ltd,20-Dec-02,20-Dec-07,Non-Current
ASQA,40114,Normand Alan David Clements,13-Dec-02,29-May-12,Cancelled
SA DFEEST,40116,Adelaide Community Healthcare Alliance Inc,20-Dec-02,20-Dec-07,Non-Current
ASQA,40117,The Minister for Education and Child Development,1-Jul-13,30-Jun-18,Current
ASQA,40118,Transport Training Solutions Pty Ltd,2-Sep-13,1-Sep-18,Current
ASQA,40119,THE FOURTH FORCE PTY LTD,1-Aug-13,31-Jul-18,Current
Vic VRQA,4012,Pedders Shock Absorber Service Pty Ltd,1-Mar-96,31-Mar-10,Non-Current
ASQA,40120,BJ Network Consulting Australia Pty Ltd,26-Mar-12,29-Apr-16,Current
ASQA,40122,Humanagement Pty Ltd,1-Jul-13,30-Jun-18,Current
ASQA,40123,SG & SG Knoll,1-Jul-13,30-Jun-18,Current
ASQA,40126,Dalynn Holdings Pty Ltd,1-Jul-13,30-Jun-18,Current
SA DFEEST,40127,Torrens Transit Services Pty Ltd,28-Jul-03,28-Jan-09,Non-Current
ASQA,40128,Norgrove Training Pty Ltd,9-Oct-13,8-Oct-18,Current
SA DFEEST,40129,"Master Painters, Decorators and Signwriters Association of SA",26-Aug-03,26-Aug-08,Non-Current
ASQA,40131,Entrepreneurship Institute Australia Pty Ltd,1-Dec-01,31-Dec-11,Non-Current
ASQA,40132,South Link Pty Ltd,22-Jan-04,18-Jul-13,Cancelled
SA DFEEST,40133,Access Training SA Pty Ltd,17-Nov-03,17-Nov-08,Non-Current
SA DFEEST,40135,S S M & Co Pty Ltd,27-Oct-03,21-Jun-08,Non-Current
SA DFEEST,40137,Pitjantjatjara Yankunytjatjara Education and Training Aboriginal Corporation,8-Dec-03,24-Apr-06,Non-Current
ASQA,40138,Career Employment Group Inc,13-Dec-13,12-Dec-18,Current
ASQA,40139,Scripture Union of South Australia Inc,18-Dec-03,17-Jan-14,Cancelled
Vic VRQA,4014,Peninsula Adult Education & Literacy Inc,1-Apr-96,31-May-11,Non-Current
SA DFEEST,40140,Hudson Global Resources (Aust) Pty Ltd,13-Feb-04,21-Jan-09,Non-Current
SA DFEEST,40141,Edge Church International Inc,19-Mar-04,18-Mar-09,Non-Current
ASQA,40142,Aboriginal Health Council of South Australia Inc,13-Feb-14,12-Feb-19,Current
SA DFEEST,40143,Asthma Foundation of South Australia Inc,13-Feb-04,12-Feb-09,Non-Current
SA DFEEST,40145,David Munt,23-Apr-04,21-Jun-08,Non-Current
ASQA,40146,Ellannie Kemp,4-May-04,31-Jul-14,Cancelled
SA DFEEST,40148,Technology Education Network Pty Ltd,11-May-04,10-May-09,Non-Current
ASQA,40149,AWC Solutions Pty Ltd,27-Apr-14,26-Apr-19,Current
Vic VRQA,4015,Jane Hackel's Health Retreat Pty Ltd,1-Dec-97,31-Dec-05,Non-Current
SA DFEEST,40151,MHS Stones and Muirden Pty Ltd,27-Apr-04,26-Apr-09,Non-Current
SA DFEEST,40152,D & R Dalby Pty Ltd,5-Jul-04,1-Jun-05,Non-Current
ASQA,40153,Grow SA Ltd,24-Feb-05,9-May-13,Cancelled
ASQA,40154,State Training Services Pty Ltd,6-Aug-04,14-Jul-14,Cancelled
SA DFEEST,40155,Wholistic Enterprises Pty Ltd,10-Aug-04,25-Mar-09,Non-Current
SA DFEEST,40156,KAZ Technology Services Pty Ltd,30-Aug-04,7-Jul-06,Non-Current
SA DFEEST,40157,General Dynamics Land Systems Australia Pty Ltd,30-Aug-04,29-Aug-09,Non-Current
ASQA,40158,Premium Wine Brands Pty Ltd,30-Aug-04,30-Jun-14,Cancelled
ASQA,4016,Peninsula Training and Employment Program Inc,1-Mar-15,28-Feb-22,Current
ASQA,40160,Subrosa Solutions Pty Ltd,18-Feb-05,17-Feb-15,Cancelled
ASQA,40161,TAFE SA,14-Aug-98,31-Dec-14,Non-Current
SA DFEEST,40162,"Minister for Employment, Training and Further Education (delivered through TAFESA)",1-Jul-03,30-Jun-08,Cancelled
SA DFEEST,40163,"Minister for Employment, Training and Further Education (delivered through TAFESA)",1-Jul-03,21-Jun-08,Cancelled
SA DFEEST,40164,Bob Jane Corporation Pty Ltd,29-Oct-04,23-Jan-09,Non-Current
ASQA,40165,T & B Solutions (Australia) Pty Ltd,4-Apr-05,22-Sep-15,Non-Current
SA DFEEST,40166,Trainee and Apprenticeship Placement Service Inc,16-Dec-04,17-Aug-09,Non-Current
ASQA,40168,J.M Christie & WM Christie & K Wareing Family Trust,4-Mar-05,25-Feb-14,Cancelled
ASQA,40169,Learning Potential International Pty Ltd,17-Feb-15,16-Feb-22,Current
ASQA,4017,Health Train Education Services Pty Ltd,1-May-15,30-Apr-22,Current
ASQA,40170,"Spark Infrastructure SA[No1] Pty Ltd, Spark Infrastructure SA[No2] Pty Ltd., Spark Infrastructure SA[No3] Pty Ltd., incorporated in Australia CKI Utilities Development Limited, PAI Utilities Developme",9-Jun-15,8-Jun-20,Current
ASQA,40171,Booth Transport Pty Ltd,28-Apr-05,27-Apr-10,Non-Current
ASQA,40173,Flight Training Adelaide Pty Ltd,17-May-15,16-May-20,Current
ASQA,40175,ACN 008 031 810 Pty Ltd,3-Aug-15,2-Aug-22,Current
ASQA,40176,HRM Pty Ltd,24-Jun-05,30-Jun-14,Cancelled
ASQA,40177,SG Learning and Development Pty Ltd,25-May-15,24-May-22,Current
ASQA,40179,Celtic Training and Consultancy Pty Ltd,9-Jun-15,8-Jun-20,Current
Vic VRQA,4018,Peopleworks Association Incorporated,2-Mar-99,11-Nov-00,Non-Current
SA DFEEST,40180,Australian Nursing Federation,19-Jul-05,31-Oct-10,Non-Current
ASQA,40181,Oz-Train Pty Ltd,9-Sep-05,22-Jun-15,Cancelled
SA DFEEST,40182,Essential Training Services Pty Ltd,5-Jul-05,3-Oct-10,Non-Current
ASQA,40183,Knowledge Plus Pty Ltd,11-Jul-05,10-Jul-15,Cancelled
ASQA,40184,Australian Computer Society Inc,1-Dec-15,30-Nov-22,Current
ASQA,40185,4Life Pty Ltd,12-Aug-15,11-Aug-22,Current
ASQA,40186,Tammy Hristakopoulos,30-Aug-15,29-Aug-22,Current
SA DFEEST,40187,Southern Community Justice Centre Inc,28-Jul-06,13-Apr-11,Non-Current
ASQA,40188,Locher & Associates Pty Ltd,19-Dec-15,18-Dec-22,Current
SA DFEEST,40189,Rhondda McMullan Pty Ltd,9-Dec-05,22-Jun-09,Non-Current
Vic VRQA,4019,PETRO-JECT Training & Equipment Centre,1-Jul-94,31-Jul-02,Non-Current
ASQA,40190,Kerrie Noelene Wade,24-Oct-15,23-Oct-22,Current
SA DFEEST,40191,Enterprise Development Group Pty Ltd,28-Feb-06,12-Oct-09,Non-Current
SA DFEEST,40192,Arris Pty Ltd,13-Dec-05,15-Jan-08,Non-Current
ASQA,40193,SMP Network Pty Ltd,26-Mar-12,22-Apr-16,Current
SA DFEEST,40194,National Jet Systems Pty Ltd,1-Feb-06,3-Sep-07,Non-Current
ASQA,40195,Rail Commissioner,26-Mar-12,27-Mar-23,Current
SA DFEEST,40197,Morphett Vale Baptist Church Inc,11-Jan-06,26-Feb-09,Non-Current
ASQA,40198,Australian Training Alliance Pty Ltd,26-Mar-12,3-May-16,Current
SA DFEEST,40199,Annesley College,9-Jun-06,2-Sep-10,Non-Current
ASQA,40200,Hospitality Industry Training Pty Ltd,26-Mar-12,8-Apr-16,Current
ASQA,40201,Child Care Services Training Australia Pty Ltd,26-Mar-12,30-Aug-16,Current
ASQA,40202,Johe Pty Ltd,26-Mar-12,5-Sep-16,Current
ASQA,40203,JADP Group Pty Ltd,1-May-06,15-Apr-15,Cancelled
ASQA,40204,World Workers Training Centre Pty Ltd,26-Mar-12,12-Jul-16,Current (Suspended)
SA DFEEST,40205,QSR Training and Development Pty Ltd,27-Oct-06,23-Aug-10,Non-Current
ASQA,40206,Innovative Training and Recruitment Pty Ltd,26-Mar-12,23-Nov-16,Current
ASQA,40207,Maritime Constructions Pty Ltd,27-Nov-06,26-Nov-11,Non-Current
SA DFEEST,40208,Kaz Group Pty Ltd,7-Jul-06,3-Aug-07,Non-Current
ASQA,40209,Drugbeat of South Australia Pty Ltd,8-Dec-06,7-Dec-11,Non-Current
ASQA,40211,Peace Centre (in Liquidation),18-Dec-06,12-Nov-15,Cancelled
SA DFEEST,40212,Do Make Up Pty Ltd,8-Dec-06,6-Dec-11,Non-Current
ASQA,40214,Minister for Communities and Social Inclusion,26-Mar-12,20-Sep-16,Current
ASQA,40216,Kaplan Business School Pty Ltd,22-Sep-06,21-Sep-11,Non-Current
ASQA,40218,Regional Transport Training Services Pty Ltd,26-Mar-12,10-Nov-16,Current
ASQA,40219,Australian Skills Development Institute Pty Ltd,27-Sep-12,26-Sep-17,Current
SA DFEEST,40220,Pegasos Strategic Training Pty Ltd,20-Dec-06,14-Feb-11,Non-Current
ASQA,40221,OneSteel Manufacturing Pty Ltd,26-Mar-12,16-May-17,Current
ASQA,40222,North East Development Agency Inc,26-Mar-12,25-Nov-16,Current
SA DFEEST,40223,Integrity Training Services Pty Ltd,26-Mar-07,27-Jan-11,Non-Current
ASQA,40224,Meridian School Incorporated,26-Mar-12,21-Feb-17,Current
ASQA,40225,Woodcroft College Inc,20-Dec-06,14-Apr-14,Cancelled
SA DFEEST,40226,Suburban Transport Services Pty Ltd,18-Jan-07,8-Sep-10,Non-Current
ASQA,40227,Vincenzo Luppino,19-Feb-07,20-Feb-14,Cancelled
