RCAB,Code,Name,Start Date,End Date,Status
Vic VRQA,5790,Internet Training Institute Pty Ltd,1-Aug-98,31-Aug-03,Non-Current
Vic VRQA,5792,NHP Electrical Engineering Products Pty Ltd,11-Aug-98,4-Nov-05,Non-Current
Vic VRQA,5793,ABET Centre,1-Sep-98,31-Aug-03,Non-Current
QLD DETE,5794,Patrick James Weston and Coralie A Murphy,20-Jan-99,19-Jan-04,Non-Current
ASQA,5795,B.L.P. TRAINING AND SERVICES PTY LTD,1-Jul-13,30-Jun-18,Current
QLD DETE,5796,BLR Investments Pty Ltd,21-Jul-98,20-Jul-03,Non-Current
ASQA,5797,Rick Davis and Associates Pty Ltd as Trustee for The A&M Mohammed Family Trust,1-Jun-14,31-May-19,Current
QLD DETE,5799,Rengain Pty Ltd,10-Mar-98,9-Mar-03,Non-Current
ASQA,5800,Alan Bartlett Consulting Pty Ltd,1-Jun-14,31-May-19,Current
QLD DETE,5805,Etiquets Pty Ltd,15-Sep-98,5-Aug-03,Non-Current
ASQA,5806,Study Group Australia Pty Limited,1-Dec-13,30-Nov-18,Current
NSW VETAB,5807,Careers Advancement College Pty Ltd,21-Aug-96,20-Aug-01,Non-Current
NSW VETAB,5809,Bankstown Helicopters Pty Ltd,1-Jan-95,30-Jun-02,Non-Current
NSW VETAB,5810,"Small Business Institute of Australasia Pty Ltd, The",10-Jun-94,22-Mar-01,Non-Current
ASQA,5811,TEIA Limited,1-Jul-13,30-Jun-18,Current
Vic VRQA,5813,Coca-Cola Amatil (Holdings) Pty Ltd,1-Aug-98,31-Aug-03,Non-Current
Vic VRQA,5814,Just Legal Pty Ltd,20-Aug-98,31-Aug-13,Cancelled
Vic VRQA,5815,"Western Metropolitan Youth Employment Project Inc, The",1-Aug-98,31-Aug-03,Non-Current
Vic VRQA,5816,Watford Corporation Pty Ltd,1-Aug-98,31-Aug-03,Non-Current
Vic VRQA,5817,SGS Australia Pty Ltd (VIC),1-Aug-98,31-Aug-03,Non-Current
Vic VRQA,5818,Task Force Community Agency Inc,16-Sep-03,31-Jul-18,Current
ASQA,5819,Geelong Ethnic Communities Council Inc,30-Jan-14,29-Jan-19,Current
Vic VRQA,5821,Food Quality Services Pty Limited,1-Aug-98,31-Aug-03,Non-Current
QLD DETE,5822,Australian Industry Group,17-Apr-98,16-Apr-03,Non-Current
QLD DETE,5825,Applied Security Concepts Training Consultants Trading As ASC Training,1-Jan-98,26-Apr-00,Non-Current
QLD DETE,5826,Australian Institute of International Understanding,30-Jun-98,29-Jun-03,Non-Current
QLD DETE,5828,Australian Mines and Metals Association,7-Apr-98,6-Apr-03,Non-Current
QLD DETE,5829,Australian Rugby League,27-Apr-98,26-Jun-03,Non-Current
QLD DETE,5831,PETER EDGAR & MARY CARMELITA FURNESS,22-Jul-98,21-Jun-08,Non-Current
ASQA,5832,ATAE Pty Ltd,1-Jun-14,31-May-19,Current
QLD DETE,5833,Bingdale Pty Ltd as Trustee for J and P Lun Family Trust,29-Sep-98,21-Jun-08,Non-Current
ASQA,5834,Capabilities Employment Service Inc,27-Mar-98,2-Jun-13,Non-Current
QLD DETE,5836,John Patrick and Christine Agnes Brady,30-Jun-98,29-Jun-03,Non-Current
QLD DETE,5837,Central Queensland University,1-Jan-98,20-Feb-02,Non-Current
QLD DETE,5838,BAYERSVILLE RESOURCE RECOVERY CENTRE,23-Mar-98,22-Mar-03,Non-Current
QLD DETE,5840,Beenleigh Business College,8-Apr-98,7-Apr-03,Non-Current
QLD DETE,5841,Centrelink - area Brisbane,1-Jan-98,21-May-01,Non-Current
QLD DETE,5842,Centrelink - Nth Qld,1-Jan-98,15-Apr-01,Non-Current
QLD DETE,5843,The Uniting Church In Australia Property Trust (Qld),1-Jan-98,23-Jul-02,Non-Current
QLD DETE,5844,Biztrain Pty Ltd,25-Mar-98,24-Mar-03,Non-Current
QLD DETE,5847,Corporation of the Trustees of the Sisters of Mercy in Queensland,28-Aug-98,21-Jun-08,Non-Current
QLD DETE,5848,Charters Towers Literacy and Learning Group Inc,28-Jul-98,27-Jul-01,Non-Current
QLD DETE,5849,Christian City Church Brisbane Ministry Training College,2-Sep-98,1-Sep-03,Non-Current
QLD DETE,5850,Brisbane Institute of Art Incorporated,1-Jan-98,2-May-02,Non-Current
QLD DETE,5851,"KEOGH, YVONNE JUNE",8-Sep-98,21-Jun-08,Non-Current
SA DFEEST,5855,South Australian Taxi Association Inc,14-Aug-98,30-Jun-04,Non-Current
QLD DETE,5856,Brisbane Migrant Resource Centre,17-Jul-98,16-Jul-03,Non-Current
QLD DETE,5857,Brisbane Refinish Supplies Pty Ltd,1-Jan-98,8-Oct-07,Non-Current
QLD DETE,5858,Bruce J.Danvers,1-Jan-98,3-Dec-02,Non-Current
QLD DETE,5859,Buderim Ginger Limited,1-Jan-98,27-May-01,Non-Current
QLD DETE,5861,Bundaberg Distilling Company Pty Ltd,31-Aug-98,30-Aug-03,Non-Current
QLD DETE,5863,Queensland Aged Care Pty Ltd T/A burpengary Gardens Aged Care Hostel,10-Mar-98,9-Mar-03,Non-Current
NSW VETAB,5873,We Teach First Aid,11-Feb-97,4-Aug-03,Non-Current
SA DFEEST,5874,Kuju Training Services,30-Sep-98,30-Sep-00,Non-Current
NSW VETAB,5875,Access Programs (NSW) Ltd,17-Sep-96,3-Apr-00,Non-Current
ASQA,5877,Lifetime International.Com Pty Ltd,3-Sep-13,2-Sep-18,Current
ASQA,5878,Jupiters Limited,6-Jan-98,31-Dec-12,Non-Current
QLD DETE,5880,Cooltemp Pty Ltd,3-Jul-98,2-Jul-03,Non-Current
QLD DETE,5884,Mandala Press Pty Ltd,3-Sep-98,2-Sep-03,Non-Current
QLD DETE,5885,Maroochy Shire Council,2-Mar-98,1-Mar-03,Non-Current
ASQA,5887,Jim Knowles Consulting Pty Ltd,1-Jul-11,21-Jun-16,Current
WA TAC,5891,Apprenticeships Australia Pty Ltd,30-Jan-13,31-Oct-17,Current
QLD DETE,5892,Jennifer Ann Bushby-white,21-Aug-98,20-Aug-03,Non-Current
QLD DETE,5893,Millennium Training,1-Jan-98,1-Feb-01,Non-Current
QLD DETE,5895,Australian Institute of Applied Sciences Pty Ltd,1-Jan-98,29-Nov-09,Non-Current
ASQA,5897,CURRUMBIN PALM BEACH RSL & SERVICES MEMORIAL CLUB INC,1-Jun-14,31-May-19,Current
QLD DETE,5898,Sharcomm Pty Ltd T/A Sharcomm Workplace First Aid,3-Aug-98,2-Aug-03,Non-Current
QLD DETE,5899,Sheraton Mirage Gold Coast Hotel,22-Jun-98,21-Jun-03,Non-Current
NSW VETAB,5900,Yarnteen Aboriginal & Torres Strait Islanders Corporation,30-Jul-96,29-Jul-01,Non-Current
NSW VETAB,5901,TCT Telecommunications Competency Training Pty Ltd,20-Aug-96,31-Dec-05,Non-Current
NSW VETAB,5902,Illawarra Training & Placement Ltd,28-May-96,27-May-01,Non-Current
QLD DETE,5903,Nisus Consulting Pty Ltd,29-Apr-98,28-Apr-03,Non-Current
QLD DETE,5904,North Goonyella Coal Mines Limited,19-May-98,18-May-03,Non-Current
QLD DETE,5905,South Burnett Adult Literacy Community Group Inc,9-Sep-98,8-Sep-03,Non-Current
QLD DETE,5910,Rae Patricia Passfield,1-Jan-98,20-Feb-02,Non-Current
ASQA,5911,Sporting Shooters Association of Australia (Qld) Inc,29-Jun-12,8-Apr-17,Current
QLD DETE,5912,St Pauls Island Council Thursday Island,17-Jun-98,16-Jun-03,Non-Current
QLD DETE,5913,Esplanade Pty Ltd,1-Jan-98,27-Oct-02,Non-Current
ASQA,5914,Farmsafe Queensland Limited,9-Jun-98,31-Mar-13,Cancelled
NSW VETAB,5915,Norman Disney & Young,18-May-96,17-May-01,Non-Current
QLD DETE,5916,Suncity Security Training Academy,23-Feb-98,22-Feb-03,Non-Current
QLD DETE,5918,Suncoast Flying Services Pty Ltd,1-Jan-98,30-Sep-00,Non-Current
ASQA,5919,First Response Australia Pty Ltd,1-Jun-14,31-May-19,Current
QLD DETE,5920,Powerlan Qld,10-Mar-98,9-Mar-03,Non-Current
QLD DETE,5922,Peachdata Pty Ltd as trustee for The Baas Family Trust,1-Jan-98,31-Oct-10,Non-Current
QLD DETE,5923,T.L.C.Training and Advisory Services Pty Ltd,1-Oct-98,1-Oct-03,Non-Current
QLD DETE,5924,QANTM Pty Ltd,27-Feb-98,1-Oct-10,Non-Current
QLD DETE,5925,Vision Queensland,1-Jan-98,25-Sep-02,Non-Current
QLD DETE,5926,The Townsville and District Education Centre Limited,1-Jan-98,14-Jan-09,Non-Current
QLD DETE,5927,Queensland Coal Pty Limited,1-Jan-98,24-Dec-02,Non-Current
NSW VETAB,5928,National Complementary Medicine College Pty Ltd,30-Jun-96,6-Dec-00,Non-Current
ASQA,5929,Alzheimer's Australia NSW,13-Sep-13,12-Sep-18,Current
QLD DETE,5931,Harry F and Shirley A Tenni,16-Jun-98,31-May-02,Non-Current
QLD DETE,5933,Temacorp Pty Ltd,1-Jan-98,15-May-08,Non-Current
QLD DETE,5934,The Foessel Family Trust,29-May-98,28-May-03,Non-Current
QLD DETE,5936,The Australian Institute of Export (Qld) Ltd,1-Jan-98,9-Apr-02,Non-Current
QLD DETE,5937,Australian Organisation for Quality Inc,19-May-98,18-May-03,Non-Current
QLD DETE,5938,"The Australian Workers' Union of Employees, Queensland",1-Jan-98,29-May-02,Non-Current
QLD DETE,5939,Franklins Ltd,1-Jan-98,17-Feb-02,Non-Current
SA DFEEST,5940,Mick Curry and Associates,1-Oct-98,31-Oct-00,Non-Current
QLD DETE,5941,Genesis Driving School,27-Jul-98,26-Jul-03,Non-Current
QLD DETE,5943,E.A.T.S.(Australia) Pty Ltd,25-Mar-98,24-Mar-03,Non-Current
NSW VETAB,5944,Milmaa Pty Ltd,30-Jun-96,8-Jan-01,Non-Current
SA DFEEST,5947,Northern Adelaide Regional Workplace Learning Centre Inc,3-Sep-98,28-Feb-03,Non-Current
QLD DETE,5948,Sharpe Whiteley and Associates Pty Ltd,28-Aug-98,27-Aug-03,Non-Current
NT DET,5949,All Drive Training Services,14-Nov-95,31-Mar-99,Non-Current
QLD DETE,5951,Telstra Learning,1-Jan-98,23-Sep-00,Non-Current
QLD DETE,5952,The FNQ Indigenous Consortium for Social and Emotional Health and Well-being Limited,19-Jun-98,18-Jun-03,Non-Current
QLD DETE,5955,The Career Centre Pty Ltd,1-Jan-98,25-Mar-02,Non-Current
QLD DETE,5957,The Construction Training Centre,1-Jan-98,26-Sep-02,Non-Current
QLD DETE,5958,Axial ITEC Ltd,1-Jan-98,31-Dec-06,Non-Current
QLD DETE,5959,Longreach and District Aged Peoples Incorporated Trading as Longreach Pioneers Hostel/Nuring Home,3-Feb-98,2-Feb-03,Non-Current
QLD DETE,5960,Ken Baker and Associates,2-Sep-98,1-Sep-03,Non-Current
QLD DETE,5961,Tourism Queensland,22-Jul-98,2-Feb-02,Non-Current
Vic VRQA,5963,ASEAN Training & Education Services Pty Ltd,1-Sep-98,30-Aug-08,Non-Current
Vic VRQA,5964,A Goninan & Co Limited,1-Sep-98,31-Aug-03,Non-Current
Vic VRQA,5965,FAFPESC Assessment Pty Ltd,20-Oct-98,13-Nov-08,Non-Current
Vic VRQA,5966,Monash University,23-Dec-05,10-Aug-10,Non-Current
Vic VRQA,5968,Welfare Rights Unit Incorporated,1-Oct-98,31-Oct-03,Non-Current
Vic VRQA,5969,Vision Australia Foundation,7-Oct-98,10-Nov-06,Non-Current
Vic VRQA,5970,Mulgrave Neighbourhood House Incorporated,24-Sep-98,3-Apr-09,Non-Current
QLD DETE,5971,The Valley Retirement Centre Inc,1-Jan-98,20-Jul-02,Non-Current
Vic VRQA,5972,Clonard College,1-Sep-98,30-Sep-03,Non-Current
Vic VRQA,5973,ISIS Innovative Solutions,9-Jan-98,30-Sep-03,Non-Current
QLD DETE,5974,The Uniting Healthcare Group,1-Jan-98,16-Oct-02,Non-Current
Vic VRQA,5975,Dun & Bradstreet (Australia) Pty Limited,22-Oct-98,27-May-05,Non-Current
Vic VRQA,5977,Morgan & Banks Pty Limited,9-Jan-98,30-Sep-03,Non-Current
QLD DETE,5978,Thiess Pty Ltd,1-Jan-98,5-Dec-02,Non-Current
Vic VRQA,5979,Remco Training Group Pty Ltd,1-Aug-98,31-Aug-03,Non-Current
Vic VRQA,5980,Driver Training Academies of Australia Pty Ltd,23-Jul-04,30-Jun-19,Current
QLD DETE,5981,Helitech Pty Ltd,19-May-98,18-May-03,Non-Current
Vic VRQA,5982,Mediquest Pty Ltd,30-Sep-08,30-Sep-18,Current
Vic VRQA,5983,Eastern Access Community Health Inc,1-Aug-98,31-Aug-03,Non-Current
Vic VRQA,5984,Planpower Training Solutions Pty Ltd,1-Sep-98,24-May-11,Non-Current
Vic VRQA,5985,Pactri International Pty Ltd,10-Sep-98,8-Jul-04,Non-Current
NSW VETAB,5986,Premier College,25-Mar-92,17-Aug-01,Non-Current
ASQA,5987,Cedar Centre Ltd,29-Jun-12,23-Jun-17,Current
ASQA,5989,Hillcourt Vocational Training Centre Pty Ltd,1-Jun-14,31-May-19,Current
ASQA,5990,"DURKIN, THOMAS KEIRAN",11-Oct-12,10-Oct-17,Current
ASQA,5994,Queensland Military Rifle Club Inc,18-Feb-14,17-Feb-19,Current
WA TAC,6000,Meerilinga Young Children's Foundation Inc,21-Mar-12,31-May-17,Current
Tas TQA,60000,Kirl Enz Pty Ltd,17-Aug-99,16-Aug-04,Non-Current
Tas TQA,60001,H & L Martin Associates,23-Sep-99,22-Sep-04,Non-Current
Tas TQA,60002,Continuing Education & Training Committee for the Huon Inc,23-Sep-04,22-Sep-07,Non-Current
ASQA,60003,Independent Health Care Service Pty Ltd,23-Sep-14,22-Sep-19,Current
Tas TQA,60004,The Underwater Centre Tasmania Pty Ltd,23-Sep-99,22-Sep-04,Non-Current
Tas TQA,60005,Tasman District School,23-Sep-04,21-Dec-11,Cancelled
Tas TQA,60006,Equity Intowork Inc,27-Oct-04,21-Jun-08,Non-Current
Tas TQA,60007,Triabunna District High School,27-Oct-04,26-Oct-09,Non-Current
Tas TQA,60008,Banjo's Corporation Pty Ltd,15-Dec-04,5-May-09,Non-Current
Tas TQA,60009,Equity Personnel Inc,15-Dec-99,14-Dec-04,Non-Current
QLD DETE,6001,Traill Blaze Communications Pty Ltd,1-Jan-98,8-Oct-02,Non-Current
Tas TQA,60010,TasTrain Pty Ltd,15-Dec-04,21-Jun-08,Non-Current
ASQA,60011,Injury Prevention Services Pty Ltd,15-Dec-04,31-Jul-13,Cancelled
Tas TQA,60012,"Community Mediation Service, Tasmania Inc.",15-Dec-04,29-Jul-07,Non-Current
ASQA,60013,Holgate Noone Pty Ltd as trustee for the Jomad Trust,15-Dec-14,14-Dec-19,Current
ASQA,60014,R.L Badcock & V.S Pickering,15-Dec-14,14-Dec-19,Current
Tas TQA,60015,Eagle Crowd Control and Security,15-Dec-99,14-Dec-04,Non-Current
ASQA,60016,Sorell School,25-Jan-05,31-May-13,Cancelled
Tas TQA,60017,Tasmanian Academy of Reflexology and Natural Sciences,3-May-00,2-May-05,Non-Current
Tas TQA,60018,Whetstone Pty Ltd,3-May-05,21-Jun-08,Non-Current
Tas TQA,60019,Tilbury Steele & Farley Hobart Pty Ltd (Farley Consulting Group),3-May-00,2-May-05,Non-Current
Tas TQA,60020,Parkside Training Services Pty Ltd,7-Jun-05,10-Dec-09,Non-Current
ASQA,60021,AMC Search Ltd,7-Jun-05,30-Jun-14,Cancelled
Tas TQA,60022,North East Education & Training Centre Inc,13-Jul-05,11-Mar-10,Non-Current
ASQA,60023,John Peter Wicks & Machelle Rose Wicks,13-Jul-00,18-Jul-12,Cancelled
Tas TQA,60024,Australian School of Fine Furniture Ltd,13-Jul-05,31-Dec-05,Non-Current
Tas TQA,60025,E-Team Australia Pty Ltd,13-Jul-00,12-Jul-05,Non-Current
Tas TQA,60026,Searson Buck Learning Pty Ltd,6-Sep-00,30-Jul-09,Non-Current
Tas TQA,60027,"Southern Training, Employment and Placement Solutions Inc (STEPS)",6-Sep-00,11-Sep-07,Non-Current
Tas TQA,60028,Sharon Rebecca Mayne,6-Sep-00,12-Apr-05,Non-Current
QLD DETE,6003,Training Information and Education,24-Jun-98,19-Jun-03,Non-Current
Tas TQA,60030,"Department of Infrastructure, Energy & Resources (Corporate Services Division)",6-Dec-00,5-Dec-05,Non-Current
Tas TQA,60031,Oskah Nominees Pty Ltd,6-Dec-00,5-Dec-10,Non-Current
Tas TQA,60032,Forth Farm Produce Pty Ltd,6-Dec-00,5-Dec-05,Non-Current
Tas TQA,60033,Southern Consulting and Training Pty Ltd,6-Dec-00,5-Dec-05,Non-Current
ASQA,60034,NDA Computing Pty Ltd,24-Jan-16,23-Jan-23,Current
ASQA,60035,Building Group Apprenticeship Scheme Ltd trading as Tasmanian Building Group Apprenticeship Scheme,1-Mar-12,13-Mar-16,Current
ASQA,60036,Guided Pathways Pty Ltd,1-Mar-12,1-May-16,Current
Tas TQA,60037,Security Services of Tasmania Pty Ltd,2-May-01,1-May-06,Non-Current
Tas TQA,60038,Protective Security Pty Ltd,16-Oct-02,25-Jul-06,Non-Current
Tas TQA,60039,Port Dalrymple School,28-Nov-01,27-Nov-09,Non-Current
QLD DETE,6004,Queensland Rural Women's Network Inc.,11-Mar-98,10-Mar-03,Non-Current
ASQA,60040,Forestry Tasmania,1-Mar-12,27-Nov-16,Current
Tas TQA,60041,Glenora District High School,23-Jan-02,21-Jan-12,Non-Current
Tas TQA,60042,Peak Farm Management Pty Ltd,13-Mar-02,9-Feb-10,Non-Current
ASQA,60043,Esset Group Pty Ltd (in liquidation),1-May-02,30-Oct-14,Cancelled
Tas TQA,60044,John Morse Computer Clarity Pty Ltd,1-May-02,21-Oct-08,Non-Current
Tas TQA,60045,Workforce Aboriginal Corporation,4-Sep-02,7-Jun-06,Non-Current
Tas TQA,60046,Integrated Group Limited,16-Oct-02,15-Oct-07,Non-Current
ASQA,60047,Southern Cross Care (Tasmania) Inc,27-Nov-12,26-Nov-17,Current
ASQA,60048,The Queen Victoria Home Incorporated,27-Nov-12,26-Nov-17,Current
Tas TQA,60049,King Island District High School,27-Nov-02,31-May-07,Non-Current
QLD DETE,6005,Department of Health Queensland,1-Jan-98,30-Nov-01,Non-Current
Tas TQA,60050,David Britton,22-Jan-03,21-Jan-08,Non-Current
Tas TQA,60051,Abacus Restart Pty Ltd,22-Jan-03,26-May-05,Non-Current
Tas TQA,60052,Tasmanian Recreational Vehicles Association Inc.,22-Jan-03,13-Dec-06,Non-Current
ASQA,60053,Dementia & Alzheimer's Association of Tasmania Inc.,1-Sep-13,31-Aug-18,Current
ASQA,60054,HR Company Pty Ltd (in liquidation),22-Jan-03,15-Aug-15,Cancelled
Tas TQA,60055,Sheffield School,22-Jan-03,9-Feb-12,Cancelled
Tas TQA,60056,Tasmanian Sports Federation Inc.,12-Mar-03,11-Mar-08,Non-Current
ASQA,60057,Anglicare Tasmania Inc,30-Apr-03,29-Apr-13,Cancelled
ASQA,60058,GlobalNet ICT Pty Ltd,1-Aug-13,31-Jul-18,Current
Tas TQA,60059,Intelli-Skills Pty Ltd,4-Jun-03,30-Mar-11,Non-Current
QLD DETE,6006,B & M Darveniza Investments Pty Ltd as Trustee for The B and M Darveniza Family Trust,17-Apr-98,21-Jun-08,Non-Current
ASQA,60060,Surf Life Saving Tasmania Inc,4-Jun-03,30-Jun-12,Cancelled
Tas TQA,60061,Brian Hevey,30-Jul-03,29-Jul-08,Non-Current
Tas TQA,60062,"David Traynor, Paul Hoddy and Vince Staggard",3-Sep-04,2-Sep-07,Non-Current
Tas TQA,60063,Campania District High School,15-Oct-03,8-Apr-08,Non-Current
Tas TQA,60064,Business and Training Pty Ltd,15-Oct-03,30-Jun-06,Non-Current
Tas TQA,60065,Works Infrastructure Pty Ltd,22-Oct-03,21-Oct-04,Non-Current
ASQA,60066,The Master Plumbers Association of Tasmania,11-Dec-03,31-May-13,Cancelled
ASQA,60067,St Michael's Association Inc,11-Dec-13,10-Dec-18,Current
Tas TQA,60068,Ouse District High School,11-Dec-03,9-Jan-12,Cancelled
Tas TQA,60069,Allan R Warren,11-Mar-04,25-Jul-06,Non-Current
ASQA,6007,Tropical Investigations and Security Service Pty Ltd,10-Feb-13,9-Feb-18,Current
Tas TQA,60070,Safetec Enterprises Pty Ltd,28-Apr-04,21-Jun-08,Non-Current
ASQA,60071,OnRoad OffRoad Pty Ltd,8-Jun-14,7-Jun-19,Current
ASQA,60072,Orange Vocational Education and Training,14-Jul-14,13-Jul-19,Current
Tas TQA,60073,Project Hahn Inc,15-Jul-04,7-Nov-06,Non-Current
Tas TQA,60074,Australian Institute of Building,22-Jul-04,21-Jun-08,Non-Current
Tas TQA,60075,Mischief Business Engineering Pty Ltd,30-Aug-04,28-Aug-09,Non-Current
ASQA,60076,The Underwater Centre Tasmania Pty Ltd,13-Sep-04,12-Sep-14,Non-Current
ASQA,60077,TAS-AIR PTY LTD (in liquidation),20-Sep-04,19-Sep-14,Non-Current
Tas TQA,60078,G J Bermingham & S M Gregory,30-Sep-04,29-Sep-09,Non-Current
Tas TQA,60079,Skyplan Australia Pty Ltd,7-Oct-04,24-Apr-08,Non-Current
ASQA,60080,Duerinckx Enterprises Pty Ltd,27-Oct-14,26-Oct-21,Current
Tas TQA,60081,Langford Support Services Inc,15-Dec-04,14-Dec-07,Non-Current
ASQA,60082,Training Services Tasmania Pty Ltd,4-Dec-14,3-Dec-19,Current
ASQA,60083,Allie Investments Pty Ltd,24-Dec-14,23-Dec-19,Current
Tas TQA,60084,Allabout Training Pty Ltd,24-Dec-04,14-Oct-09,Non-Current
Tas TQA,60085,Tasmanian College of Beauty Therapy & Health Science,21-Feb-05,20-Feb-08,Non-Current
Tas TQA,60086,Australia-Tasmania College of Technology Pty Ltd,21-Feb-05,20-Feb-08,Non-Current
Tas TQA,60087,Scottsdale High School,31-Mar-05,30-Mar-10,Non-Current
Tas TQA,60088,The International College of Personal Radiance Pty Ltd as trustee for International College of Personal Radiance Trust,13-Apr-05,30-Mar-11,Non-Current
Tas TQA,60089,NGT Training Pty Ltd,30-May-05,21-Jun-08,Non-Current
QLD DETE,6009,Tyre Service Training,1-Jan-98,7-Nov-02,Non-Current
ASQA,60090,Echelon National Security Agency Pty Ltd,27-Jun-05,3-Dec-12,Non-Current
Tas TQA,60091,Australasian Fire & Emergency Response College Pty Ltd,2-Aug-05,29-Mar-11,Non-Current
Tas TQA,60092,Newhaven Consultancy Pty Ltd,27-Jul-05,21-Jun-08,Non-Current
Tas TQA,60093,University of Tasmania,5-Aug-05,29-May-06,Non-Current
Tas TQA,60094,RWTA Pty Ltd,15-Aug-05,5-Aug-10,Non-Current
ASQA,60095,Workskills Incorporated,17-Aug-05,10-Apr-15,Cancelled
Tas TQA,60096,Danny Bellette,27-Oct-05,26-Oct-10,Non-Current
Tas TQA,60097,Connect Assess Australia Limited,28-Nov-05,21-Jun-08,Cancelled
Tas TQA,60098,Results Training Group Pty Ltd,1-Jan-06,15-Jul-10,Non-Current
ASQA,60099,Salamanca Consultancy Services Pty Ltd,20-Dec-05,14-Dec-14,Non-Current
ASQA,60100,Tasmanian Secondary Colleges,9-Feb-16,8-Feb-23,Current
ASQA,60101,The Training & Business Company Pty Ltd,9-Mar-14,8-Mar-19,Current
Tas TQA,60102,Hobart Regional Water Authority,15-Mar-06,29-Sep-09,Non-Current
ASQA,60103,Workforce Development Pty Ltd,1-Mar-12,5-Apr-16,Current
ASQA,60105,Tasmanian Aboriginal Centre Inc.,7-Feb-16,6-Feb-23,Current
Tas TQA,60106,Platon Enterprises Pty Ltd as trustee for Platon Family Trust,25-Jul-06,8-Jun-11,Cancelled
Tas TQA,60107,Tasmanian Protective Services Pty Ltd,25-Jul-06,21-Jun-08,Non-Current
ASQA,60108,The Arthritis Foundation of Tasmania Inc,1-Mar-12,24-Jul-16,Current
Tas TQA,60109,Speedfox Consultancy Pty Ltd,16-Aug-06,15-Mar-10,Non-Current
QLD DETE,6011,Qru Recreation Group Training Company Ltd,1-Jan-98,3-May-01,Non-Current
Tas TQA,60110,Taswide Training Pty Ltd,28-Aug-06,13-May-11,Non-Current
Tas TQA,60111,"Australian Technical College, Northern Tasmania Ltd",11-Sep-06,11-Jan-10,Non-Current
Tas TQA,60112,G & A L Mason & A K & C J C Plumbridge,19-Sep-06,18-Sep-11,Cancelled
ASQA,60113,Community Potential Foundation Ltd,9-Nov-06,14-Jun-14,Cancelled
Tas TQA,60114,S. J. Hughes & S. L. Smith-Wagin,9-Jan-07,21-Jun-08,Non-Current
Tas TQA,60116,Madelaine Reissig,31-Jan-07,14-Jul-10,Non-Current
Tas TQA,60117,AMMA Education & Training Pty Ltd,27-Feb-07,30-Mar-11,Non-Current
ASQA,60118,Motorsports Tasmania Pty Ltd,26-Feb-07,25-Feb-12,Non-Current
Tas TQA,60120,Seerose Pty Ltd,26-Apr-07,30-Nov-11,Cancelled
Tas TQA,60121,L Allen and P J Allen,14-May-07,18-Aug-10,Non-Current
Tas TQA,60123,Western Aviation Pty Ltd,28-May-07,20-Oct-10,Non-Current
Tas TQA,60125,Brendan Viti,17-Aug-07,29-Oct-08,Non-Current
ASQA,60127,P & C Wheatley Pty Ltd as Trustees for Works Well Unit Trust,11-Sep-07,31-Aug-13,Non-Current
Tas TQA,60128,STEPS Housing Ltd,11-Sep-07,5-Sep-10,Non-Current
Tas TQA,60129,Lynda Williams,27-Sep-07,16-Dec-09,Non-Current
ASQA,6013,QLD ABORIGINAL & TORRES STRAIT ISLANDER HEALTH WORKER EDUCATION PROG,8-Jul-99,16-Jan-13,Cancelled
ASQA,60130,Pivot Maritime International Pty Ltd,5-Feb-13,4-Feb-18,Current
ASQA,60131,University of Tasmania,1-Jan-13,31-Dec-17,Current
ASQA,60132,Dynamic Rescue Pty Ltd,8-May-08,30-Jun-11,Non-Current
ASQA,60134,Handa Solutions Pty Ltd,1-Oct-13,30-Sep-18,Current
ASQA,60135,Civil Construction Training Tasmania Pty Ltd,18-Jul-08,16-Aug-12,Cancelled
ASQA,60138,Forest Industries Skills Training Pty Ltd,1-Dec-13,30-Nov-18,Current
Tas TQA,60139,Complete IT Training Pty Ltd,26-Sep-08,19-Jul-11,Cancelled
QLD DETE,6014,E.A.T.S.(Australia) Pty Ltd,25-Mar-98,25-Mar-03,Non-Current
ASQA,60141,Con Ed Pty Ltd,3-Nov-08,27-Nov-13,Cancelled
ASQA,60142,TasTAFE,31-Dec-13,30-Dec-18,Current
ASQA,60143,TasTAFE,1-Jan-09,1-Jul-13,Cancelled
ASQA,60144,Kirsten Singleton,23-Dec-13,22-Dec-18,Current
Tas TQA,60145,Explain IT Pty Ltd,15-Jan-09,21-Nov-11,Cancelled
ASQA,60146,Diogel Pty Ltd,1-Jun-14,31-May-19,Current
ASQA,60147,Harvey Edward Griggs,19-Feb-09,18-Feb-14,Cancelled
Tas TQA,60148,MedStaff Training Australia Pty Ltd,19-Feb-09,1-Apr-10,Non-Current
ASQA,60149,Driver Skills Australia Pty Ltd,24-Feb-09,18-Jan-13,Cancelled
QLD DETE,6015,THE UNITING CHURCH IN AUSTRALIA PROPERTY TRUST (Q.),1-Jan-98,30-Sep-08,Non-Current
Tas TQA,60150,Industrial Licencing Solutions Pty Ltd,16-Apr-09,23-Jan-12,Cancelled
ASQA,60152,ACC Services (Tas) Pty Ltd,8-Jul-09,7-Jul-14,Non-Current
ASQA,60153,Avidity Training Pty Ltd,31-Jul-15,30-Jul-22,Current
ASQA,60154,MMC Link Pty Ltd,14-Oct-14,13-Oct-19,Current
ASQA,60155,Devonfield Enterprises Inc.,14-Oct-14,13-Oct-19,Current
ASQA,60156,Northern Joblink Limited,21-Oct-14,20-Oct-19,Current
ASQA,60157,Stephen Robert Shaw,12-Nov-09,11-Nov-14,Non-Current
QLD DETE,6016,Hubbard's Academy Pty Ltd as trustee for the Stevens Family Trust,19-May-98,21-Jun-08,Non-Current
Tas TQA,60160,Northern Vocational School,1-Jan-10,5-Jan-11,Non-Current
ASQA,60162,Campbell Page Limited,31-Jan-15,30-Jan-20,Current
Tas TQA,60163,Stephanie Pearton & Fiona McFadyen,1-Apr-10,2-Feb-11,Non-Current
ASQA,60164,Youth Futures Incorporated,26-Apr-15,25-Apr-20,Current
ASQA,60165,HornMac Pty Ltd,1-Jun-10,31-May-15,Non-Current
ASQA,60166,St Brendan Shaw Catholic College,19-May-10,14-Jun-13,Cancelled
ASQA,60168,Quick Service Training Pty Ltd,1-Aug-15,31-Jul-22,Current
ASQA,60169,Tasmanian Protective Services Pty Ltd,1-Mar-15,28-Feb-22,Current
QLD DETE,6017,Valued Training Pty Ltd,1-Jan-98,8-Dec-02,Non-Current
ASQA,60170,Jenasi Pty Ltd,23-Dec-10,22-Jun-14,Cancelled
Tas TQA,60171,Harrison Lesley Ann,12-Jan-11,14-Feb-12,Cancelled
ASQA,60172,Fiona Maree McFadyen,27-Jan-11,31-Dec-14,Cancelled
ASQA,60174,The MiCBT Institute Pty Ltd,20-May-11,29-Jan-16,Cancelled
ASQA,60175,"BISHOP, Kelli-Jane",29-Mar-11,17-Oct-13,Cancelled
ASQA,60177,Industrylink Training Pty Ltd,1-Mar-12,26-Mar-23,Current
ASQA,60179,William Adams Pty Ltd,1-Mar-12,31-May-16,Current
QLD DETE,6018,Hyatt Coolum Resort Pty Ltd,20-Apr-98,19-Apr-03,Non-Current
ASQA,60180,Skyplan Australia Pty Ltd,1-Mar-12,31-May-16,Current
ASQA,60181,Sharkra Academy of Aesthetics Pty Ltd,30-Aug-11,30-Dec-15,Cancelled
ASQA,60182,Tensegrity Training Pty Ltd,1-Mar-12,12-Oct-16,Current
ASQA,6019,Volunteer Marine Rescue Assoc Qld Inc,29-Jun-12,28-Feb-23,Current
ASQA,6020,Volunteering Queensland Inc,29-Jun-12,19-Apr-16,Current
QLD DETE,6021,Wakabeso,8-Sep-98,7-Sep-03,Non-Current
ASQA,6022,Community Programs Association Inc,28-Feb-12,27-Feb-17,Current
QLD DETE,6023,Warner World Australia Pty Ltd & Village Theme Park Management Pty Ltd,1-Jan-98,20-Jan-03,Non-Current
QLD DETE,6024,"MAGARRY, ALAN J",1-Jan-98,12-Aug-07,Non-Current
ACT DET,6025,Department of Health and Aged Care,26-Oct-98,31-Dec-00,Non-Current
NSW VETAB,6026,Forestry & Allied Timber Industries NSW Group Training Scheme Co Ltd,27-May-96,26-May-01,Non-Current
ASQA,6027,WESTSIDE COMMUNITY SERVICES LIMITED,1-Nov-13,31-Oct-18,Current
ASQA,6028,Whitsunday Sailing Club Limited,29-Jun-12,11-Feb-17,Current
QLD DETE,6029,Lindsay Thomas Winters,1-Jan-98,13-Jul-07,Non-Current
Vic VRQA,6030,Kokoro Enterprises Pty Ltd,31-Aug-08,31-Aug-18,Current
QLD DETE,6031,Winton Shire Council (Community and Individual Support Program),1-Jan-98,5-Aug-02,Non-Current
QLD DETE,6032,Woodford Correctional Centre,20-Aug-98,19-Aug-03,Non-Current
QLD DETE,6034,Work Focus Training and Consulting Services Pty Ltd,1-Jan-98,24-Oct-02,Non-Current
ASQA,6035,Biba Academy of Hair & Beauty Pty Ltd,1-Aug-15,31-Jul-22,Current
