RCAB,Code,Name,Start Date,End Date,Status
Vic VRQA,22518,Northern Bay P-12 College,30-Dec-10,30-Dec-20,Current
SA DFEEST,2252,HiFert Pty Ltd,1-Jan-97,31-Jan-00,Non-Current
Vic VRQA,22520,Response Learning Victoria Pty Ltd.,31-Oct-12,31-Oct-17,Current
Vic VRQA,22521,Advanced Global Training Pty Ltd,6-Dec-11,20-Jan-12,Cancelled
ASQA,22522,"Institute for Sports, Entrepreneurship & Management Pty Ltd",16-Jul-13,30-Jun-16,Current
ASQA,22523,Career Education Association of Victoria Inc,16-Apr-12,30-Nov-16,Current
Vic VRQA,22524,JADS Driver Training Pty Ltd,21-Feb-12,31-Jan-17,Current
Vic VRQA,22525,V/Line Pty Ltd,8-Dec-11,30-Nov-16,Current
ASQA,22526,Australian Society for Quality Pty Ltd,10-Dec-13,30-Nov-16,Current
Vic VRQA,22527,Lauras International Training Pty Ltd,21-Feb-12,26-Aug-13,Cancelled
ASQA,22528,National Skills Institute Pty Ltd,19-Jun-12,31-Dec-16,Current
ASQA,22530,Monarch Institute Pty Ltd,6-Nov-12,30-Nov-16,Current
Vic VRQA,22533,Erigo Training Pty Ltd,22-Jun-12,31-May-17,Current
ASQA,22537,Global Education and Training Group Pty Ltd,20-Mar-15,31-Aug-16,Current
SA DFEEST,2254,Defensive Roadcraft Pty Ltd,1-Jan-97,31-Dec-00,Non-Current
Vic VRQA,22541,Mallee Family Care Inc,15-Jun-12,17-Oct-14,Cancelled
Vic VRQA,22542,Serve it Up Training Pty Ltd,10-Jan-12,31-Dec-16,Current
Vic VRQA,22545,Labtech Training Victoria Pty Ltd.,21-Jul-14,21-Jul-19,Current
Vic VRQA,22549,Australian Salesmasters Training Co (Victoria) Pty Ltd,14-Jun-12,31-May-17,Current
SA DFEEST,2255,Bruce Arthur Ledo,1-Jan-97,31-Jan-00,Non-Current
ASQA,22550,Baimbridge College,13-May-15,28-Feb-23,Current
Vic VRQA,22552,Business Risks International Training and Elearning Centre Pty Ltd,21-Aug-12,31-Jul-17,Current
Vic VRQA,22556,Plumbing Industry Climate Action Centre (PICAC) Ltd,9-Nov-12,31-Oct-17,Current
ASQA,22557,FOUNDATION EDUCATION PTY LTD,13-Dec-12,30-Sep-17,Current
Vic VRQA,22559,Association for Christian Education Mt Evelyn Inc,8-Dec-11,30-Nov-16,Current
SA DFEEST,2256,The Corporation of the City of Marion,1-Jan-97,30-Jun-99,Non-Current
ASQA,22560,Agoge Education Australia Pty Ltd,15-Aug-14,30-Sep-17,Current
Vic VRQA,22561,South Eastern Health Providers Association Inc.,4-Dec-12,31-Oct-17,Current
Vic VRQA,22569,Massage Institute Australia Pty Ltd,11-Apr-13,28-Feb-18,Current
SA DFEEST,2257,Edge Training (SA) Pty Ltd,1-Jan-97,31-Jan-00,Non-Current
Vic VRQA,22570,Intelligent Training Solutions Pty Ltd,10-Jul-13,30-Jun-18,Current
Vic VRQA,22573,A Grade Motor School Pty Ltd,18-Dec-12,31-Oct-17,Current
Vic VRQA,22575,Alpine Health,7-Jan-13,30-Nov-17,Current
Vic VRQA,22576,Victorian Aboriginal Community Services Association Ltd,27-May-13,30-Apr-18,Current
Vic VRQA,22577,Setting the Standard Training Pty Ltd,19-Jul-13,30-Jun-18,Current
ASQA,2258,Australian Institute of Business Pty Ltd,26-Mar-12,30-Dec-16,Current
Vic VRQA,22580,Contix Pty Ltd,13-Nov-13,30-Sep-18,Current
Vic VRQA,22581,Victorian Education and Training Group Pty Ltd,8-Nov-13,31-Oct-18,Current
Vic VRQA,22582,CRK Training Pty Ltd,15-Jul-13,15-Jul-18,Current
Vic VRQA,22585,Connect People Training Pty Ltd,15-Jul-13,15-Jul-18,Current
Vic VRQA,22587,Peninsula Boat Training Pty Ltd,9-Sep-13,31-Jul-18,Current
SA DFEEST,2259,Aspect Computing Pty Ltd,12-Mar-96,31-Dec-00,Non-Current
Vic VRQA,22591,Narre Warren South P-12 College,15-Jul-13,31-May-18,Current
Vic VRQA,22592,Ashleys Health Care Pty Ltd,17-Sep-13,31-Aug-18,Current
Vic VRQA,22593,Magenta Safety Training Pty Ltd,21-Oct-13,30-Sep-18,Current
Vic VRQA,22594,Australian Vietnamese Women's Association Inc,30-Jun-14,31-May-19,Current
Vic VRQA,22595,Advanced Educational Institute Pty Ltd,23-Jun-14,11-Sep-15,Cancelled
Vic VRQA,22596,Migrant Resource Centre North West Region Inc.,23-Jun-15,31-May-20,Current
Vic VRQA,22597,Building and Construction Training Australia Pty Ltd,23-Jun-14,31-May-19,Current
Vic VRQA,22602,Australian Federation of Ethnic Schools Association Inc,23-Dec-14,30-Nov-19,Current
Vic VRQA,22604,A.T.T.N. Pty Ltd,2-Mar-15,31-Jan-20,Current
Vic VRQA,22606,Centre for Advanced Studies in Building & Construction Management Pty Ltd,28-Feb-15,28-Feb-20,Current
Vic VRQA,22608,Newhaven College Pty Ltd,15-Jun-15,30-Apr-20,Current
Vic VRQA,22609,N.S.E. RTO Pty Ltd,10-Apr-15,28-Feb-20,Current
SA DFEEST,2261,AQIS Training Services,1-Jan-97,30-Jun-99,Non-Current
Vic VRQA,22612,Roxburgh College,29-Jan-16,29-Jan-21,Current
SA DFEEST,2262,Department of Defence,14-Aug-96,30-Jun-99,Non-Current
SA DFEEST,2263,Integrated Employment Association SA Inc,27-Jun-96,31-Jan-00,Non-Current
SA DFEEST,2264,Roger Feely and Associates,1-Sep-99,23-Mar-01,Non-Current
SA DFEEST,2265,David Wass,7-Oct-96,30-Jun-99,Non-Current
SA DFEEST,2267,Chubb Security Australia Pty Ltd,10-Jul-02,9-Jul-07,Non-Current
SA DFEEST,2268,Mara Tjuta Inc,1-Jan-97,30-Jun-99,Non-Current
SA DFEEST,2270,Australian Motoring Consultancy,1-Jan-97,31-Dec-00,Non-Current
SA DFEEST,2272,Ramage Pty Ltd,1-Jan-97,30-Jun-99,Non-Current
SA DFEEST,2273,Australian Funeral Directors Association,1-Jan-97,30-Jun-99,Non-Current
SA DFEEST,2274,Just Parks and Gardens Pty Ltd,1-May-01,30-Apr-04,Non-Current
SA DFEEST,2275,Elizabeth Jane Tillett and John O'Flaherty,1-Jan-97,31-Jan-00,Non-Current
SA DFEEST,2276,"Shearing Competition Federation of Australia Inc, SA Branch",28-Aug-96,31-Dec-00,Non-Current
SA DFEEST,2277,Mr Laury Bais,1-Jul-99,20-Jun-01,Non-Current
ASQA,2278,Andrew George Marks and Elizabeth Kathryn Marks,29-Sep-14,29-Sep-19,Current
ASQA,2279,Personnel Development and Training Pty Ltd,26-Mar-12,31-Jul-16,Current
ASQA,2280,South Australian Sports Federation Inc,30-Jun-14,29-Jun-19,Current
SA DFEEST,2282,Employ SA Inc,1-Oct-98,31-Mar-04,Non-Current
SA DFEEST,2286,ACI Australia Ltd,22-Nov-96,30-Jun-99,Non-Current
SA DFEEST,2288,Television Typing Centre Pty Ltd,23-Dec-98,30-Nov-02,Non-Current
SA DFEEST,2290,Central Linen,20-Sep-96,28-Feb-01,Non-Current
SA DFEEST,2291,Hoverservices Pty Ltd,1-Jan-97,31-Mar-01,Non-Current
ASQA,2292,Tactical Training (Australia) Pty Ltd,10-Oct-13,9-Oct-18,Current
ASQA,2293,The MTA Group Training Scheme Inc,2-Sep-13,1-Sep-18,Current
SA DFEEST,2294,Consultel Australia Pty Ltd,25-Jul-96,31-Dec-00,Non-Current
SA DFEEST,2296,Target Australia Pty Ltd,9-Feb-01,31-Dec-03,Non-Current
SA DFEEST,2298,Security Institute,1-Jan-97,30-Jun-99,Non-Current
SA DFEEST,2299,Australian Institute of Sport,1-Jan-97,30-Jun-99,Non-Current
SA DFEEST,2300,Australian Institute of Applied Science Pty Ltd,1-Jan-97,30-Jun-99,Non-Current
SA DFEEST,2302,People Orientated Systems (Aust) Pty Ltd,1-Jan-97,31-Dec-00,Non-Current
SA DFEEST,2303,Ngapartji Pty Ltd,18-Dec-02,18-Dec-07,Non-Current
SA DFEEST,2304,Business Cultures International Pty Ltd,23-Dec-96,31-Jan-00,Non-Current
SA DFEEST,2305,Lynay Community Centre,13-Dec-96,31-Jan-00,Non-Current
SA DFEEST,2306,Fusion Australia Ltd (SA),30-Jun-98,30-Jun-00,Non-Current
SA DFEEST,2308,UnitingCare Wesley Adelaide Inc,30-Jan-03,23-Feb-11,Non-Current
SA DFEEST,2309,Midway Community House Inc,13-Dec-96,30-Jun-99,Non-Current
ASQA,2310,Careers Australia College of Healthcare Pty Ltd,11-Jun-03,11-Jun-13,Non-Current
SA DFEEST,2311,"Rolf von Behrens, Rohan Story, Rohan Pinto",8-Jul-96,31-Jan-00,Non-Current
SA DFEEST,2312,Community Business Bureau Inc,11-Dec-02,11-Dec-07,Non-Current
SA DFEEST,2313,Maxwell J Tatnell,1-Jun-99,3-Jun-03,Non-Current
ASQA,2316,Media Make-up Academy & Agency Pty Ltd,1-Jan-15,31-Dec-21,Current
WA TAC,2317,Group Training South West (Inc),11-Sep-14,30-Jun-19,Current
WA TAC,2319,Australian Institute of Export,1-Jan-97,31-Dec-97,Non-Current
WA TAC,2320,Forest Heritage Centre Inc,29-Oct-09,8-Nov-13,Cancelled
WA TAC,2321,Professional and Career Development (PACD) - WADOT,24-Jan-97,15-Jul-01,Cancelled
WA TAC,2322,Business Starters Network Pty Ltd,7-Dec-00,30-Jun-04,Non-Current
WA TAC,2323,Mirage Group Pty Ltd,25-Oct-96,31-Dec-99,Non-Current
ASQA,2325,Cambridge International College (WA) Pty Ltd,1-Jan-13,31-Dec-17,Current
Tas TQA,2326,Island Health College,26-May-99,25-May-04,Non-Current
Tas TQA,2327,Mummers Pty Ltd,12-Dec-00,16-Aug-04,Non-Current
Tas TQA,2328,Mersey Leven Aboriginal Corporation,1-Sep-97,19-Nov-00,Non-Current
Tas TQA,2329,NDA Computing,21-Jan-97,31-Dec-97,Non-Current
Tas TQA,2330,TasCOSS,21-Jan-97,4-Sep-01,Non-Current
Tas TQA,2331,The Oatlands School,15-Dec-04,11-Sep-06,Non-Current
ASQA,2332,Launceston Student Workshop Inc,17-Aug-04,16-Aug-14,Non-Current
SA DFEEST,2339,Alan and Catherine Logue,30-Mar-04,21-Mar-12,Cancelled
SA DFEEST,2340,SYP Youth Care Inc,9-Feb-96,31-Jan-00,Non-Current
SA DFEEST,2341,Job Care Australia Pty Ltd,1-Aug-97,31-Jan-00,Non-Current
SA DFEEST,2342,Maze Computing Services,1-Jul-97,30-Jun-99,Non-Current
SA DFEEST,2343,Leonie Green and Associates Pty Ltd,30-Oct-96,30-Jun-99,Non-Current
SA DFEEST,2344,Julie Kathleen Stokes,29-Oct-96,31-Jan-00,Non-Current
SA DFEEST,2345,House of Training Pty Ltd,29-Oct-98,31-Oct-01,Non-Current
SA DFEEST,2346,Hamstone Pty Ltd,6-Jun-03,19-Oct-06,Non-Current
SA DFEEST,2347,Elizabeth Jane Tillett,3-Aug-96,31-Jan-00,Non-Current
SA DFEEST,2350,Nutri-Metics International (Australia) Pty Ltd,23-Dec-96,30-Jun-99,Non-Current
SA DFEEST,2351,Rimila Pty Ltd,21-Dec-96,30-Jun-99,Non-Current
SA DFEEST,2352,Southern Tablelands Education Centre Co-operative Ltd,29-Nov-96,30-Jun-99,Non-Current
ASQA,2353,ASC Training & Development Pty Ltd,1-Jan-15,31-Dec-19,Current
SA DFEEST,2354,Mission Australia,1-Aug-93,31-Dec-00,Non-Current
SA DFEEST,2355,Australian Institute of Export (SA) Ltd,6-Jun-01,9-Mar-06,Non-Current
ASQA,2356,South Australia Police,24-Sep-99,28-Feb-14,Cancelled
SA DFEEST,2359,Essential Computer Systems Pty Ltd,21-Nov-96,31-Dec-00,Non-Current
SA DFEEST,2360,BAE Flight Training (Australia) Pty Ltd,23-Feb-04,10-Nov-05,Non-Current
SA DFEEST,2361,Getronics Pty Ltd,1-Aug-99,31-Dec-02,Non-Current
SA DFEEST,2362,Immanuel College,30-Sep-99,31-Dec-03,Non-Current
NSW VETAB,2366,Southern Pacific Hotel Corporation Ltd,13-Nov-96,12-May-02,Non-Current
NSW VETAB,2369,Integral Energy,17-Jan-97,9-Jan-02,Non-Current
ASQA,2370,Tauondi Inc,17-Dec-12,16-Dec-17,Current
SA DFEEST,2371,College Of Traditional Therapies (SA) Pty Ltd,18-Dec-96,31-Dec-00,Non-Current
SA DFEEST,2372,Clements School of Management,1-Apr-98,31-Mar-07,Non-Current
SA DFEEST,2373,Bliss Automotive Pty Ltd,2-May-97,21-Oct-01,Non-Current
SA DFEEST,2374,Roger Welsh,22-Mar-04,31-Dec-06,Non-Current
NT DET,2376,J & G Asia Consultants,2-May-97,31-Jan-00,Non-Current
ASQA,2378,Nhulunbuy High School Council Inc,1-Jul-11,9-Jun-16,Current
ASQA,2379,Northern Territory Chamber of Commerce & Industry Inc,1-May-99,3-Dec-13,Cancelled
NT DET,2380,HTC Vocational Institute (NT),1-Jan-96,31-Dec-98,Non-Current
ASQA,2382,Accrete Pty Ltd,1-Jun-14,31-May-19,Current
WA TAC,2383,Linda Gregory,14-Nov-96,31-Dec-00,Non-Current
WA TAC,2384,Fire and Rescue Service of WA - Forrestfield,1-Jan-97,31-Dec-00,Non-Current
WA TAC,2385,Bush Fire Service of WA,29-Nov-96,31-Dec-99,Non-Current
ASQA,2386,Australian Transactional Analysis Association Incorporated,7-Nov-96,30-Jun-14,Non-Current
WA TAC,2387,B P Oil Kwinana Refinery,1-Jan-97,31-Dec-01,Non-Current
WA TAC,2388,NetFX Australia Pty Ltd,1-Jan-97,1-Jan-01,Non-Current
WA TAC,2389,Australian Fire Services College Pty Ltd,29-Nov-96,31-Dec-99,Non-Current
WA TAC,2390,"Food Centre of Western Australia Inc, The",29-Nov-96,31-Dec-99,Non-Current
WA TAC,2391,Canning Valley Enterprise Development Inc,29-Nov-96,31-Aug-97,Non-Current
WA TAC,2392,Chelbar Pty Ltd,17-Jul-97,21-Jun-08,Non-Current
WA TAC,2393,South Metropolitan Migrant Resource Centre,28-Aug-97,31-Dec-99,Non-Current
ASQA,2394,College of Electrical Training Incorporated (CET),7-Jan-15,31-Dec-17,Current
WA TAC,2395,South West Job Link,29-Nov-96,31-Dec-00,Non-Current
WA TAC,2396,"Scout Association of Australia, The - WA Branch",29-Nov-96,31-Dec-98,Non-Current
WA TAC,2398,"Southern Tablelands Education Centre Co-operative Ltd, (WA)",25-Nov-96,29-Aug-98,Non-Current
WA TAC,2399,"Improved Communication Skills (Australia), (WA)",29-Nov-96,21-Jul-01,Non-Current
WA TAC,2400,Nutri-Metics International (Australia) Pty Ltd (WA),29-Nov-96,14-Aug-01,Non-Current
ASQA,2401,Skills Strategies International Pty Ltd,1-May-14,30-Apr-19,Current
WA TAC,2402,Engineering Assessors,9-Dec-99,30-Jun-02,Non-Current
WA TAC,2403,Tabor College- WA,29-Mar-96,31-May-99,Non-Current
WA TAC,2404,DJM Welding Services Pty Ltd,1-Jan-97,31-Dec-97,Non-Current
WA TAC,2405,Australian Institute of Environmental Health (WA Division),1-Jan-97,31-Dec-00,Non-Current
WA TAC,2406,Asstock Pty Ltd,24-Jan-97,31-Dec-99,Non-Current
WA TAC,2407,Australasian Maritime Institute Pty Ltd,13-Mar-14,30-Jun-18,Current
WA TAC,2410,Hydramet Pty Ltd,1-Jan-97,31-Dec-00,Non-Current
ASQA,2411,Riverview Church Incorporated,9-Nov-93,31-May-12,Cancelled
WA TAC,2412,PROCAD Pty Ltd,1-Jan-97,31-Dec-01,Non-Current
WA TAC,2413,Skilled Directions,24-Jan-97,19-Mar-01,Non-Current
WA TAC,2414,MBA Construction Training Institute Inc,20-Dec-96,31-Dec-00,Non-Current
WA TAC,2415,Association of Wall & Ceiling Contractors of WA (Inc),20-Dec-96,31-Dec-00,Non-Current
WA TAC,2416,SSTC Perth International College,14-Mar-97,31-Dec-00,Cancelled
ASQA,2417,Sterling Business College Pty Ltd,1-Aug-14,31-Jul-19,Current
WA TAC,2419,Iikon Pty Ltd,19-Jul-01,31-Dec-04,Non-Current
WA TAC,2420,Australian Fabricare Institute Pty Ltd,20-Dec-96,13-Feb-01,Non-Current
WA TAC,2421,West Coast Institute of Management & Technology,24-Jan-97,31-Mar-04,Cancelled
WA TAC,2422,Learning Centre Link,7-Dec-00,31-Dec-03,Non-Current
WA TAC,2423,The Homestead - Division of Saints Care Ltd,12-Dec-96,30-Sep-04,Non-Current
WA TAC,2424,City Of Fremantle,18-Oct-01,31-Dec-04,Non-Current
WA TAC,2425,The Gowrie (WA) Inc.,15-Jul-09,30-Jun-14,Cancelled
WA TAC,2426,Tresillion Community Centre,1-Jan-97,31-Dec-97,Non-Current
WA TAC,2427,South East Metropolitan College of TAFE - Thornlie Campus,20-Dec-96,31-Dec-98,Non-Current
WA TAC,2428,Esperance Group Training Scheme Inc,11-Dec-02,30-Jun-07,Cancelled
WA TAC,2429,Hospitality Training Company Australia - WA,20-Dec-96,30-May-97,Non-Current
WA TAC,2430,Laminex Industries,20-Dec-96,31-Dec-99,Non-Current
ASQA,2431,Australian Training Management Pty Ltd,1-Apr-13,31-Mar-18,Current
WA TAC,2432,Green Skills Inc,12-Dec-96,31-Jan-13,Non-Current
WA TAC,2433,South West Institute of Technology,15-May-14,30-Nov-18,Current
Tas TQA,2434,Master Builders' Association of Tasmania Inc,15-Dec-99,14-Dec-04,Non-Current
QLD DETE,2435,The Corporation of The Trustees of The Roman Catholic Archdiocese of Brisbane,1-Jan-98,31-Jan-07,Non-Current
QLD DETE,2436,WILLIAMSON FAMILY TRUST,1-Jan-98,31-Jan-07,Non-Current
ASQA,2437,Axial Training Pty Ltd,22-Aug-12,21-Aug-17,Current
QLD DETE,2438,Betaray Pty Ltd as Trustee for the Embrey Family Trust,1-Jan-98,21-Jun-08,Non-Current
QLD DETE,2439,Challenge Assessments Pty Ltd,1-Jan-98,5-Feb-02,Non-Current
QLD DETE,2440,Dialog Pty Ltd,1-Jan-98,6-Feb-07,Non-Current
ASQA,2441,The Spectrum Organization Association Inc,29-Jun-12,12-Dec-16,Current
NSW VETAB,2443,Australian Banking Operations (ABO) Group Westpac Banking Corporation,11-Feb-97,10-Apr-02,Non-Current
NSW VETAB,2451,"NSW College of Nursing, The",17-Feb-97,27-Feb-04,Non-Current
NSW VETAB,2453,Illawarra Aboriginal Corporation Community Development Project,1-Jan-96,31-Dec-00,Non-Current
NT DET,2455,Miwatj Health Aboriginal Corporation Inc,1-Sep-00,31-Aug-03,Non-Current
NT DET,2457,Cleanthous and Deo,5-Mar-97,28-Feb-00,Non-Current
NT DET,2459,Night Watch Security NT,1-Aug-97,28-Feb-04,Non-Current
ACT DET,2460,The National Institute of Health Sciences Pty Ltd,1-Jan-95,1-Mar-07,Non-Current
ACT DET,2461,Safety Network (Australia) Pty Ltd,20-Feb-97,22-Apr-07,Non-Current
ASQA,2462,ACT Government Health Directorate,1-Jul-11,6-Jun-17,Current
WA TAC,2464,Milcan Pty Ltd,10-Mar-03,31-Mar-08,Cancelled
WA TAC,2465,Goldfields Institute of Technology,9-May-13,31-Jul-17,Current
WA TAC,2466,First Aid And Emergency Resources,19-Apr-01,30-Jun-04,Non-Current
WA TAC,2467,"Australian Nanny School, The (WA)",24-Jan-97,31-Dec-98,Non-Current
SA DFEEST,2468,Peter Middleton,1-Jan-97,31-Jan-00,Non-Current
SA DFEEST,2471,Sports Massage Training School Pty Ltd,1-Jan-00,31-May-02,Non-Current
SA DFEEST,2472,Marie Beardsley,8-Jul-99,3-Oct-01,Non-Current
Tas TQA,2473,Tasmanian Construction Training Pty Ltd,17-Aug-99,16-Aug-04,Non-Current
Tas TQA,2474,Tasmanian Outdoor Leadership Council Inc,19-Mar-97,26-Feb-99,Non-Current
Tas TQA,2475,Young Aussie Enterprise Inc,9-Dec-98,8-Dec-03,Non-Current
ACT DET,2476,Volunteering ACT,1-Jan-97,24-Jun-02,Non-Current
ACT DET,2478,Construction Industry Skills Centre Incorporated,17-Feb-97,1-Feb-01,Non-Current
ACT DET,2479,Stirling College Association Incorporated,1-Jan-97,23-Feb-01,Non-Current
ACT DET,2480,Hawker College Parents and Citizens Association,1-Jan-97,31-Jan-01,Non-Current
ACT DET,2481,Southern Business Services (Marketing) Pty Ltd,4-Jul-97,27-Jun-02,Non-Current
ASQA,2484,Choice Solutions Inc,28-May-09,28-May-14,Non-Current
NSW VETAB,2486,National Learning Institute Pty Ltd,6-Feb-97,16-Feb-07,Non-Current
NSW VETAB,2488,Waverley Council,26-Jan-96,3-Sep-08,Non-Current
NSW VETAB,2489,John Holland Construction & Engineering Pty Ltd,3-Mar-97,2-Apr-02,Non-Current
NSW VETAB,2492,Uniworld Business College,17-Mar-97,7-Oct-09,Non-Current
NSW VETAB,2494,Carling & Associates Pty Ltd,23-Oct-96,15-Mar-05,Non-Current
NSW VETAB,2495,Kincumber Adult & Community Education Centre Inc,1-Jan-98,5-Jun-00,Non-Current
ACT DET,2496,University of Canberra - Faculty of Management,1-Jan-95,31-Dec-99,Non-Current
ASQA,2497,Australian Hotels Association (NSW),17-Oct-12,16-Oct-17,Current
NSW VETAB,2498,Council of the City of South Sydney,25-Mar-97,31-May-06,Non-Current
QLD DETE,2501,Alastair Colin Ottway,1-Jan-98,17-Jun-02,Non-Current
QLD DETE,2503,Newlands Coal Pty Ltd,1-Jan-98,23-Dec-02,Non-Current
QLD DETE,2504,AMC Search Ltd,1-Jan-98,2-Feb-02,Non-Current
QLD DETE,2506,Inprint Ltd,1-Jan-98,24-Jan-02,Non-Current
ASQA,2507,KING'S INTERNATIONAL COLLEGE LTD,29-Nov-01,27-Nov-15,Cancelled
ASQA,2508,Charlton Brown Pty Ltd,30-Sep-15,29-Sep-22,Current
QLD DETE,2509,Directions (Australia) Pty Ltd As Trustee for the WK Trust,1-Jan-98,18-Oct-11,Cancelled
ASQA,2510,MW Training Consultants Pty Ltd as trustee for The Morgan-Williams Family Trust,29-Jun-12,3-Jun-16,Current
ASQA,2512,Alzheimer's Australia Vic Inc,1-Oct-15,30-Sep-22,Current
WA TAC,2514,PEST Australia Pty Ltd,14-Aug-14,31-Mar-19,Current
WA TAC,2515,Crime Prevention Services of WA,1-Jan-97,31-Dec-00,Non-Current
WA TAC,2516,Vilcom Pty Ltd,7-Dec-00,31-Dec-03,Non-Current
WA TAC,2517,Ionnakis & Associates,24-Jan-97,31-Dec-01,Non-Current
WA TAC,2518,Trade Skills Training Pty Ltd,20-Feb-97,6-Oct-06,Non-Current
WA TAC,2519,Tree Guild of WA (Inc),24-Jan-97,31-Dec-01,Non-Current
WA TAC,2520,Australian Customs Service (WA),24-Jan-97,31-Dec-99,Non-Current
WA TAC,2521,Swan Taxis Pty Ltd,9-Apr-15,31-Dec-19,Current
ASQA,2522,Petya Pty Ltd,1-Sep-14,31-Aug-19,Current
WA TAC,2523,Hedland Bus Lines Pty Ltd,24-Jan-97,31-Aug-97,Non-Current
WA TAC,2524,Stirling Business Enterprise Centre,24-Jan-97,31-Dec-99,Non-Current
WA TAC,2526,"Moreland Group, The",24-Jan-97,19-Feb-00,Non-Current
WA TAC,2527,Adroit Human Resources Pty Ltd,24-Jan-97,31-Dec-98,Non-Current
WA TAC,2528,Southern Pacific Hotel Corporation Ltd,24-Jan-97,31-Dec-98,Non-Current
WA TAC,2529,APACE Aid Inc,14-Mar-97,31-Dec-00,Non-Current
WA TAC,2530,Sexual Assault Referral Centre,1-Jan-97,31-Dec-97,Non-Current
WA TAC,2531,The HACC Training Brokerage (Inc),7-Dec-00,31-Dec-03,Non-Current
WA TAC,2532,Midland College of TAFE (refer to Swan College),14-Dec-95,1-May-97,Cancelled
WA TAC,2533,Kalgoorlie Consolidated Gold Mines Pty Ltd,1-Jan-97,31-Dec-97,Non-Current
ASQA,2534,Wellparks Holdings Pty Ltd,1-Sep-14,31-Aug-19,Current
WA TAC,2535,Eastern Metropolitan Regional Council,18-Dec-97,16-Sep-11,Cancelled
WA TAC,2536,West Coast Institute of Training,13-Sep-12,30-Jun-17,Current
WA TAC,2538,The Calix Group,20-Mar-97,30-Jun-08,Non-Current
WA TAC,2540,Barbara Grinsell And Associates,16-Mar-00,30-Jun-03,Non-Current
WA TAC,2541,Albany Regional Prison,14-Mar-97,31-Dec-99,Non-Current
WA TAC,2542,Ubiquitous Holdings Pty Ltd,20-Mar-97,31-Dec-97,Non-Current
ASQA,2543,Thompson Human Resources Pty Ltd,4-Dec-13,3-Dec-18,Current
Tas TQA,2544,Starwood Australia Pty Ltd,16-Apr-97,15-Apr-02,Non-Current
ASQA,2545,John Geoffrey Kirwan & Sandra Mary Kirwan,15-Dec-04,26-Jun-15,Non-Current
Tas TQA,2546,Compass Training Australia Pty Ltd,26-May-99,25-May-04,Non-Current
Tas TQA,2547,John Kelleher & Associates Pty Ltd,28-Apr-99,27-Apr-04,Non-Current
Tas TQA,2548,Rosebery District High School,17-Aug-04,16-Aug-09,Non-Current
Tas TQA,2549,SETORI Engineering Pty Ltd,16-Apr-97,30-Mar-02,Non-Current
ACT DET,2550,ACT Ambulance Service,10-Apr-97,23-Sep-04,Non-Current
ASQA,2551,PARASOL EMT Pty Limited,31-Mar-12,30-Mar-17,Current
ACT DET,2552,ECOWISE Environmental Ltd,4-Mar-97,5-Mar-02,Non-Current
NT DET,2555,Maggie Rutherford & Associates,1-May-00,30-Apr-03,Non-Current
ASQA,2556,Darwin High School Council Inc,1-May-99,31-Jul-12,Cancelled
NT DET,2558,Central Australian Aboriginal Congress Inc,11-Jan-98,31-Mar-10,Non-Current
NT DET,2559,Able Based Learning Experiences (A.B.L.E. NT Div),1-Jan-97,31-Dec-00,Non-Current
ASQA,2571,Winifred West Schools Ltd,1-Jul-11,20-Jun-16,Current
NSW VETAB,2573,Freight Train (Australia) Pty Ltd,7-Apr-97,30-May-01,Non-Current
NSW VETAB,2574,Wingsair Academy Australia,8-Dec-93,7-Dec-98,Non-Current
NSW VETAB,2576,Interdependent Solutions Pty Ltd,15-Oct-01,14-Oct-09,Non-Current
NSW VETAB,2577,Uniting Church Property Trust (NSW) for Wesley Mission,14-Oct-95,23-Apr-02,Non-Current
NSW VETAB,2578,Pulse Independent Professional Trainers,24-Mar-97,24-Apr-02,Non-Current
NSW VETAB,2579,Business Thinking Systems Pty Ltd,2-Apr-97,1-Apr-02,Non-Current
NSW VETAB,2580,Waratah Education Centre Pty Ltd,25-Mar-94,9-Mar-05,Non-Current
NSW VETAB,2583,Allandale Nursing Home,9-Apr-97,8-Apr-02,Non-Current
NSW VETAB,2584,CCH Learning Pty Ltd,11-Apr-97,20-Jul-05,Non-Current
NSW VETAB,2585,"Searl, M J & Smith, L J-NSW",17-Apr-97,26-May-04,Non-Current
NSW VETAB,2587,4WD Off Road Driver Training Pty Ltd,22-Apr-97,11-Dec-08,Non-Current
NSW VETAB,2588,Illawarra Children's Services Ltd,31-May-97,30-May-02,Non-Current
NSW VETAB,2591,Jenarus Training & Development Pty Ltd,22-Apr-97,11-Jan-02,Non-Current
NSW VETAB,2598,"Australasian Management Academy Pty Ltd, The",14-Apr-97,10-Jul-01,Non-Current
WA TAC,2600,Stara Training and Consultancy Services,1-Jan-97,1-Jan-01,Non-Current
WA TAC,2603,Auston Institute of Management and Technology Pty Ltd,17-Apr-97,4-Apr-05,Non-Current
WA TAC,2604,Geographe Training Centre Inc,4-Nov-97,31-Dec-00,Non-Current
NSW VETAB,2605,Tourism Employment & Training Corporation,18-Dec-96,21-Dec-01,Non-Current
WA TAC,2606,Flower Design School Pty Ltd,17-Apr-97,31-Dec-09,Non-Current
NSW VETAB,2608,Sydney Interlink College,1-Jan-95,3-Apr-00,Non-Current
NSW VETAB,2614,Creative World Pty Ltd,1-Jan-98,19-Jun-02,Non-Current
NSW VETAB,2637,Australian Institutes of Export,1-Jan-98,31-Dec-02,Non-Current
NSW VETAB,2643,Omni Human Resource Systems Pty Ltd,10-Apr-96,31-Aug-01,Non-Current
ASQA,2646,SGS Australia Pty Ltd,1-Jul-11,30-Dec-16,Current
NSW VETAB,2649,Australian College of Entertainment Ltd,30-Aug-96,7-Aug-00,Non-Current
NSW VETAB,2657,Sydney Jet Charter,11-Nov-96,3-Apr-04,Non-Current
ASQA,2658,St Patrick's Business College Ltd,1-Jul-11,30-Jun-16,Current
NSW VETAB,2669,Orff-Schulwerk Association of NSW Inc,26-Nov-96,7-Jun-99,Non-Current
NSW VETAB,2681,Centre for Education & Information in Drugs & Alcohol (CEIDA),18-Apr-96,17-Apr-01,Non-Current
ASQA,2686,Office of Environment and Heritage,7-Sep-15,6-Sep-22,Current
NSW VETAB,2689,Our Town Fire Protection,24-Mar-97,23-Jun-02,Non-Current
NSW VETAB,2696,Gough & Gilmour Holdings Pty Ltd,10-Mar-97,11-Jan-06,Non-Current
NSW VETAB,2697,Unitingcare NSW.ACT,29-Apr-97,15-Mar-11,Non-Current
NSW VETAB,2698,Australian College of Justice & Law Administration Pty Ltd,8-Feb-97,30-Nov-03,Non-Current
NSW VETAB,2699,Augustine Services Pty Ltd,24-Apr-97,26-Aug-10,Non-Current
NSW VETAB,2702,Life Education Australia,17-Apr-97,5-May-07,Non-Current
NSW VETAB,2707,"Pathline Group, The",15-Jun-96,18-Jun-02,Non-Current
QLD DETE,2751,Hospitality Training Association Inc,1-Jan-98,20-Oct-11,Cancelled
QLD DETE,2757,Department of Families,1-Jan-98,29-Sep-02,Non-Current
ASQA,2762,Careflight (QLD) Limited,1-Oct-15,30-Sep-22,Current
QLD DETE,2763,Toowong College,1-Jan-98,21-Oct-08,Non-Current
ASQA,2769,QR Limited,1-Jan-98,28-Jun-12,Cancelled
QLD DETE,2785,United Tax and Accounting Pty Ltd,1-Jan-98,30-Sep-00,Non-Current
QLD DETE,2796,Town and Country Nannies Pty Ltd,1-Jan-98,30-Sep-05,Non-Current
QLD DETE,2800,Queensland Corrective Services Commission,20-Nov-98,19-Nov-03,Non-Current
QLD DETE,2801,The Verner-Mackay Group Pty Ltd,1-Jan-98,11-Jun-01,Non-Current
QLD DETE,2803,Mieste Maria Higgins,1-Jan-98,30-Sep-05,Non-Current
ASQA,2804,Surf Life Saving Queensland,29-Jun-12,16-Jan-17,Current
ASQA,2808,PROFESSIONAL ASSOCIATION OF CLIMBING INSTRUCTORS PTY. LTD.,8-Nov-15,7-Nov-22,Current
QLD DETE,2809,Torgas Inc,1-Jan-98,13-Mar-02,Non-Current
QLD DETE,2814,Inala Community House,28-Jan-98,28-Jan-03,Non-Current
QLD DETE,2816,East Coast Nail and Beauty Supplies Pty Ltd,1-Jan-98,31-Jan-01,Non-Current
QLD DETE,2828,South Burnett Meat Works Co-operative Association Ltd,1-Jan-98,5-Dec-00,Non-Current
QLD DETE,2835,Sheraton Pacific Hotels Pty Ltd,1-Jan-98,30-Nov-05,Non-Current
QLD DETE,2837,Twin Towns Employment Enterprises Limited,1-Jan-98,31-Dec-01,Non-Current
ASQA,2839,Tyco Australia Pty Ltd,29-Jun-12,22-Feb-23,Current
